title,rating,total_votes,show_desc,year,link,genre,encoded_title
The Grand Tour,8.6,71000,"Follow Jeremy, Richard, and James, as they embark on an adventure across the globe, driving new and exciting automobiles from manufacturers all over the world.",2016,https://www.imdb.com/title/tt5712554,"Comedy, Sport, Talk-Show",tt5712554
Ramayan,8.6,19000,"An adaptation of the ancient epic, in which the exiled Prince Rama and his brother Laxman set out to save Rama's wife, Sita, who has been kidnapped by the demon king of Lanka Ravana.",1987,https://www.imdb.com/title/tt0268093,"Adventure, Drama, Family",tt0268093
Star Trek: The Next Generation,8.6,114000,"Set almost 100 years after Captain Kirk's five-year mission, a new generation of Starfleet officers set off in the U.S.S. Enterprise-D on their own mission to go where no one has gone before.",1987,https://www.imdb.com/title/tt0092455,"Action, Adventure, Sci-Fi",tt0092455
It's a Sin,8.6,28000,"A chronicle of four friends during a decade in which everything changed, including the rise of AIDS.",2021,https://www.imdb.com/title/tt9140342,"Comedy, Drama, History",tt9140342
Deadwood,8.6,103000,"A show set in the late 1800s, revolving around the characters of Deadwood, South Dakota; a town of deep corruption and crime.",2004,https://www.imdb.com/title/tt0348914,"Crime, Drama, History",tt0348914
Top Gear,8.6,115000,"The hosts talk about everything car-related. From new cars to how they're fueled, this show has it all.",2002,https://www.imdb.com/title/tt1628033,"Adventure, Comedy, Reality-TV",tt1628033
Atlanta,8.6,62000,"Based in Atlanta, Earn and his cousin Alfred try to make their way in the world through the rap scene. Along the way they come face to face with social and economic issues touching on race, relationships, poverty, status, and parenthood.",2016,https://www.imdb.com/title/tt4288182,"Comedy, Drama, Music",tt4288182
Young Justice,8.6,38000,Teenage superheroes strive to prove themselves as members of the Justice League.,2010,https://www.imdb.com/title/tt1641384,"Animation, Action, Adventure",tt1641384
Lonesome Dove,8.6,22000,Two former Texas Rangers renew their spirit of adventure as they and several other residents of a small Texas town join a cattle drive to the Montana Territory.,1989,https://www.imdb.com/title/tt0096639,"Adventure, Drama, Western",tt0096639
Haikyuu!!,8.6,20000,"Determined to be like the volleyball championship's star player Shouyou, a short boy nicknamed ""the small giant,"" joins his school's volleyball club.",2014,https://www.imdb.com/title/tt3398540,"Animation, Comedy, Drama",tt3398540
Dopesick,8.6,38000,"The series takes viewers to the epicenter of America's struggle with opioid addiction, from the boardrooms of Purdue Pharma, to a distressed Virginia mining community, to the hallways of the DEA.",2021,https://www.imdb.com/title/tt9174558,Drama,tt9174558
Mad Men,8.6,227000,"A drama about one of New York's most prestigious ad agencies at the beginning of the 1960s, focusing on one of the firm's most mysterious but extremely talented ad executives, Donald Draper.",2007,https://www.imdb.com/title/tt0804503,Drama,tt0804503
Code Geass,8.6,62000,"After being given a mysterious power to control others, an outcast prince becomes the masked leader of the rebellion against an all powerful empire",2006,https://www.imdb.com/title/tt0994314,"Animation, Action, Drama",tt0994314
The Bridge,8.6,66000,"When a body is found on the bridge between Denmark and Sweden, right on the border, Danish inspector Martin Rohde and Swedish Saga Norén have to share jurisdiction and work together to find the killer.",2011,https://www.imdb.com/title/tt1733785,"Crime, Mystery, Thriller",tt1733785
Sarabhai V/S Sarabhai,8.6,16000,"The show revolves around the lives of the members of an Uber Wealthy - High Society Gujarati family of Cuffe Parade - South Bombay, whose daughter-in-law is from a middle class Delhi background.",2004,https://www.imdb.com/title/tt1518542,Comedy,tt1518542
Formula 1: Drive to Survive,8.6,32000,Docuseries following the FIA Formula One World Championship across multiple seasons.,2019,https://www.imdb.com/title/tt8289930,"Documentary, Sport",tt8289930
Demon Slayer: Kimetsu no Yaiba,8.6,78000,"A family is attacked by demons and only two members survive - Tanjiro and his sister Nezuko, who is turning into a demon slowly. Tanjiro sets out to become a demon slayer to avenge his family and cure his sister.",2019,https://www.imdb.com/title/tt9335498,"Animation, Action, Adventure",tt9335498
Yellowstone,8.6,97000,A ranching family in Montana faces off against others encroaching on their land.,2018,https://www.imdb.com/title/tt4236770,"Drama, Western",tt4236770
Monster,8.6,26000,A brilliant neurosurgeon finds his life in utter turmoil after getting involved with a psychopathic former patient.,2004,https://www.imdb.com/title/tt0434706,"Animation, Crime, Drama",tt0434706
Blackadder II,8.6,45000,"In the Tudor court of Elizabeth I, Lord Edmund Blackadder strives to win Her Majesty's favour while attempting to avoid a grisly fate should he offend her.",1986,https://www.imdb.com/title/tt0088484,Comedy,tt0088484
Peep Show,8.6,58000,Mark and Jez are a couple of twenty-something roommates who have nothing in common - except for the fact that their lives are anything but normal. Mayhem ensues as the pair strive to cope with day-to-day life.,2003,https://www.imdb.com/title/tt0387764,Comedy,tt0387764
The X-Files,8.6,215000,"Two F.B.I. Agents, Fox Mulder the believer and Dana Scully the skeptic, investigate the strange and unexplained, while hidden forces work to impede their efforts.",1993,https://www.imdb.com/title/tt0106179,"Crime, Drama, Mystery",tt0106179
Parks and Recreation,8.6,242000,The absurd antics of an Indiana town's public officials as they pursue sundry projects to make their city a better place.,2009,https://www.imdb.com/title/tt1266020,Comedy,tt1266020
Gomorrah,8.6,37000,Ciro disregards tradition in his attempt to become the next boss of his crime syndicate. The internal power struggle puts him and his entire family's life at risk.,2014,https://www.imdb.com/title/tt2049116,"Crime, Drama, Thriller",tt2049116
Friday Night Lights,8.6,63000,"A drama that follows the lives of the Dillon Panthers, one of the nation's best high school football teams, and their head coach Eric Taylor.",2006,https://www.imdb.com/title/tt0758745,"Drama, Sport",tt0758745
Mindhunter,8.6,260000,"Set in the late 1970s, two FBI agents are tasked with interviewing serial killers to solve open cases.",2017,https://www.imdb.com/title/tt5290382,"Crime, Drama, Thriller",tt5290382
Battlestar Galactica,8.6,73000,"Following the destruction of the Twelve Colonies of Kobol by the Cylons, a rag-tag fugitive fleet of the last remnants of mankind flees the pursuing Cylons while simultaneously searching for their true home: Earth.",2003,https://www.imdb.com/title/tt0314979,"Action, Adventure, Drama",tt0314979
Anne with an E,8.6,49000,"The adventures of a young orphan girl living in the late 19th century. Follow Anne as she learns to navigate her new life on Prince Edward Island, in this new take on L.M. Montgomery's classic novels.",2017,https://www.imdb.com/title/tt5421602,"Drama, Family",tt5421602
Father Ted,8.6,39000,"Three misfit priests and their housekeeper live on Craggy Island, not the peaceful and quiet part of Ireland that it seems to be.",1995,https://www.imdb.com/title/tt0111958,Comedy,tt0111958
The Bureau,8.6,11000,"After six years of undercover work in Syria, French intelligence officer Malotru returns home, where he struggles to forget his undercover identity, train a young recruit, and investigate when a colleague disappears in Algeria.",2015,https://www.imdb.com/title/tt4063800,"Drama, Thriller",tt4063800
Jujutsu Kaisen,8.5,43000,A boy swallows a cursed talisman - the finger of a demon - and becomes cursed himself. He enters a shaman's school to be able to locate the demon's other body parts and thus exorcise himself.,2020,https://www.imdb.com/title/tt12343534,"Animation, Action, Adventure",tt12343534
Dexter,8.5,705000,"He's smart. He's lovable. He's Dexter Morgan, America's favorite serial killer, who spends his days solving crimes and nights committing them. Golden Globe winner Michael C. Hall stars in the hit SHOWTIME Original Series.",2006,https://www.imdb.com/title/tt0773262,"Crime, Drama, Mystery",tt0773262
The Haunting of Hill House,8.5,221000,"Flashing between past and present, a fractured family confronts haunting memories of their old home and the terrifying events that drove them from it.",2018,https://www.imdb.com/title/tt6763664,"Drama, Horror, Mystery",tt6763664
The Bugs Bunny Show,8.5,33000,TV series featuring the classic Looney Tunes animated shorts.,1960,https://www.imdb.com/title/tt0053488,"Animation, Comedy",tt0053488
Blackadder the Third,8.5,43000,"In the Regency era, Mr E. Blackadder serves as butler to the foppish numskull Prince George amidst the fads and crazes of the time.",1987,https://www.imdb.com/title/tt0092324,Comedy,tt0092324
Daredevil,8.5,408000,"A blind lawyer by day, vigilante by night. Matt Murdock fights the crime of New York as Daredevil.",2015,https://www.imdb.com/title/tt3322312,"Action, Crime, Drama",tt3322312
Westworld,8.5,467000,"Set at the intersection of the near future and the reimagined past, explore a world in which every human appetite can be indulged without consequence.",2016,https://www.imdb.com/title/tt0475784,"Drama, Mystery, Sci-Fi",tt0475784
Panchayat,8.5,49000,"A comedy-drama, which captures the journey of an engineering graduate Abhishek, who for lack of a better job option joins as secretary of a Panchayat office in a remote village of Uttar Pradesh.",2020,https://www.imdb.com/title/tt12004706,"Comedy, Drama",tt12004706
This Is Us,8.5,126000,"A heartwarming and emotional story about a unique set of triplets, their struggles and their wonderful parents.",2016,https://www.imdb.com/title/tt5555260,"Comedy, Drama, Romance",tt5555260
Gullak,8.5,12000,"Set in quaint by-lanes in the heart of India, Gullak is a collection of disarming and relatable tales of the Mishra family.",2019,https://www.imdb.com/title/tt10530900,"Comedy, Drama, Family",tt10530900
Archer,8.5,149000,Covert black ops and espionage take a back seat to zany personalities and relationships between secret agents and drones.,2009,https://www.imdb.com/title/tt1486217,"Animation, Action, Comedy",tt1486217
The Queen's Gambit,8.5,390000,"Orphaned at the tender age of nine, prodigious introvert Beth Harmon discovers and masters the game of chess in 1960s USA. But child stardom comes at a price.",2020,https://www.imdb.com/title/tt10048342,Drama,tt10048342
The Newsroom,8.5,112000,"A newsroom undergoes some changes in its workings and morals as a new team is brought in, bringing unexpected results for its existing news anchor.",2012,https://www.imdb.com/title/tt1870479,Drama,tt1870479
Crash Landing on You,8.5,23000,The absolute top secret love story of a chaebol heiress who made an emergency landing in North Korea because of a paragliding accident and a North Korean special officer who falls in love with her and who is hiding and protecting her.,2019,https://www.imdb.com/title/tt10850932,"Adventure, Comedy, Romance",tt10850932
Yes Minister,8.5,14000,"The Right Honorable James Hacker has landed the plum job of Cabinet Minister to the Department of Administration. At last he is in a position of power and can carry out some long-needed reforms, or so he thinks.",1980,https://www.imdb.com/title/tt0080306,Comedy,tt0080306
Rurouni Kenshin: Trust and Betrayal,8.5,14000,"In the era of Japan's Meiji Restoration, an assassin regains his humanity.",1999,https://www.imdb.com/title/tt0203082,"Animation, Action, Adventure",tt0203082
Poirot,8.5,43000,"The cases of eccentric, but sharp, Belgian detective Hercule Poirot.",1989,https://www.imdb.com/title/tt0094525,"Crime, Drama, Mystery",tt0094525
Yeh Meri Family,8.5,23000,Set in the summer of 1998 it is a story about conflicting emotions towards family members from the eyes of a twelve year old.,2018,https://www.imdb.com/title/tt8595766,"Comedy, Drama, Family",tt8595766
Behzat Ç.: Bir Ankara Polisiyesi,8.5,29000,"Centered around a personally troubled, officially discredited police chief and his inharmonious police team in Ankara Police Force. Even though the show usually focuses on murders and other crimes that happens on a weekly basis, the undertone of the story leads to an eventual duel between Behzat Ç. and the rotten department officials and bureaucrats.",2010,https://www.imdb.com/title/tt1795096,"Crime, Drama, Mystery",tt1795096
QI,8.5,31000,"A comedy panel game in which being Quite Interesting is more important than being right. Sandi Toksvig is joined each week by four comedians to share anecdotes and trivia, and maybe answer some questions as well.",2003,https://www.imdb.com/title/tt0380136,"Comedy, Game-Show",tt0380136
The Family Man,8.5,80000,"A working man from the National Investigation Agency tries to protect the nation from terrorism, but he also needs to keep his family safe from his secret job.",2019,https://www.imdb.com/title/tt9544034,"Action, Comedy, Drama",tt9544034
Through the Wormhole,8.5,18000,,2010,https://www.imdb.com/title/tt1513168,Documentary,tt1513168
Justified,8.5,95000,"U.S. Marshal Raylan Givens is reassigned from Miami to his childhood home in the poor, rural coal mining towns of eastern Kentucky.",2010,https://www.imdb.com/title/tt1489428,"Action, Crime, Drama",tt1489428
What We Do in the Shadows,8.5,62000,"A look into the daily (or rather, nightly) lives of three vampires, who've lived together for over 100 years, on Staten Island.",2019,https://www.imdb.com/title/tt7908628,"Comedy, Fantasy, Horror",tt7908628
Mr. Bean,8.5,113000,"Bumbling, childlike Mr. Bean has trouble completing the simplest of tasks in day-to-day life, but his perseverance and resourcefulness frequently allow him to find ingenious ways around problems.",1990,https://www.imdb.com/title/tt0096657,"Comedy, Family",tt0096657
Making a Murderer,8.5,92000,"Filmed over a 10-year period, Steven Avery, a DNA exoneree who, while in the midst of exposing corruption in local law enforcement, finds himself the prime suspect in a grisly new crime.",2015,https://www.imdb.com/title/tt5189670,"Documentary, Crime",tt5189670
Naruto: Shippûden,8.5,111000,"Naruto Uzumaki, is a loud, hyperactive, adolescent ninja who constantly searches for approval and recognition, as well as to become Hokage, who is acknowledged as the leader and strongest of all ninja in the village.",2007,https://www.imdb.com/title/tt0988824,"Animation, Action, Adventure",tt0988824
North & South,8.5,32000,"North and South is a four part adaptation of Elizabeth Gaskell's love story of Margaret Hale, a middle class southerner who is forced to move to the northern town of Milton.",2004,https://www.imdb.com/title/tt0417349,"Drama, Romance",tt0417349
Justice League,8.5,45000,Seven of the most formidable heroes form arguably the most powerful team ever.,2001,https://www.imdb.com/title/tt0275137,"Animation, Action, Adventure",tt0275137
Spaced,8.5,53000,"Friends Tim and Daisy, 20-something North Londoners with uncertain futures, must pretend to be a couple to live in the only apartment they can afford.",1999,https://www.imdb.com/title/tt0187664,"Action, Comedy",tt0187664
Neon Genesis Evangelion,8.5,62000,A teenage boy finds himself recruited as a member of an elite team of pilots by his father.,1995,https://www.imdb.com/title/tt0112159,"Animation, Action, Drama",tt0112159
Boardwalk Empire,8.5,183000,An Atlantic City politician plays both sides of the law by conspiring with gangsters during the Prohibition era.,2010,https://www.imdb.com/title/tt0979432,"Crime, Drama, History",tt0979432
Samurai Champloo,8.5,46000,"Fuu, a waitress who works in a teahouse, rescues two master swordsmen, Mugen and Jin, from their execution to help her find the ""samurai who smells of sunflowers.""",2004,https://www.imdb.com/title/tt0423731,"Animation, Action, Adventure",tt0423731
Mob Psycho 100,8.5,25000,"A psychic middle school boy tries to live a normal life and keep his growing powers under control, even though he constantly gets into trouble.",2016,https://www.imdb.com/title/tt5897304,"Animation, Action, Comedy",tt5897304
From the Earth to the Moon,8.5,12000,Dramatized portrayal of the Apollo manned space program.,1998,https://www.imdb.com/title/tt0120570,"Action, Drama, History",tt0120570
The Eric Andre Show,8.5,17000,"Eric Andre tries to host a talk show in a bizarre environment, where he is sometimes the player of pranks and sometimes the victim.",2012,https://www.imdb.com/title/tt2244495,Comedy,tt2244495
Pose,8.5,27000,"In the New York of the late 80s and early 90s, this is a story of ball culture and the gay and trans community, the raging AIDS crisis and capitalism.",2018,https://www.imdb.com/title/tt7562112,Drama,tt7562112
Long Way Round,8.5,14000,"This documentary series follows actors Ewan McGregor and Charley Boorman on a motorcycle trip around the world. The two friends will travel through such places as Siberia, Kazakhstan, Mongolia, and Alaska, before finally ending the journey in New York. The filming will be done by on board cameras and one ride along cameraman.",2004,https://www.imdb.com/title/tt0403778,"Documentary, Adventure",tt0403778
Twin Peaks,8.5,64000,Picks up 25 years after the inhabitants of a quaint northwestern town are stunned when their homecoming queen is murdered.,2017,https://www.imdb.com/title/tt4093826,"Crime, Drama, Horror",tt4093826
Adventure Time,8.5,88000,"A 12-year-old boy and his best friend, wise 28-year-old dog with magical powers, go on a series of surreal adventures with each other in a remote future.",2010,https://www.imdb.com/title/tt1305826,"Animation, Action, Adventure",tt1305826
Dragon Ball,8.5,54000,"Son Gokû, a fighter with a monkey tail, goes on a quest with an assortment of odd characters in search of the Dragon Balls, a set of crystals that can give its bearer anything they desire.",1986,https://www.imdb.com/title/tt0088509,"Animation, Action, Adventure",tt0088509
Flight of the Conchords,8.5,59000,"Bret and Jemaine are Flight of the Conchords, a folk-rock band from New Zealand living in New York City in search of stardom.",2007,https://www.imdb.com/title/tt0863046,"Comedy, Music, Musical",tt0863046
Dragon Ball,8.5,58000,"Dragon Ball tells the tale of a young warrior by the name of Son Goku, a young peculiar boy with a tail who embarks on a quest to become stronger and learns of the Dragon Balls, when, once all 7 are gathered, grant any wish of choice.",1995,https://www.imdb.com/title/tt0280249,"Animation, Action, Adventure",tt0280249
"Yes, Prime Minister",8.5,11000,James Hacker was propelled along the corridors of power to the very pinnacle of politics - Number 10.,1986,https://www.imdb.com/title/tt0086831,Comedy,tt0086831
Cobra Kai,8.5,159000,"Decades after their 1984 All Valley Karate Tournament bout, a middle-aged Daniel LaRusso and Johnny Lawrence find themselves martial-arts rivals again.",2018,https://www.imdb.com/title/tt7221388,"Action, Comedy, Drama",tt7221388
Mr. Robot,8.5,368000,"Elliot, a brilliant but highly unstable young cyber-security engineer and vigilante hacker, becomes a key figure in a complex game of global dominance when he and his shadowy allies try to take down the corrupt corporation he works for.",2015,https://www.imdb.com/title/tt4158110,"Crime, Drama, Thriller",tt4158110
The IT Crowd,8.5,145000,"The comedic misadventures of Roy, Moss and their grifting supervisor Jen, a rag-tag team of IT support workers at a large corporation headed by a hotheaded yuppie.",2006,https://www.imdb.com/title/tt0487831,Comedy,tt0487831
Letterkenny,8.5,20000,"Quick-witted, fast-paced snappy comedy about rural folk getting by in a small town.",2016,https://www.imdb.com/title/tt4647692,Comedy,tt4647692
Mystery Science Theater 3000,8.5,24000,"In the not-too-distant future Joel Robinson is held captive by Dr. Forrester and TV's Frank, forced to watch B-Grade movies on the Satellite of Love with the help of his robot friends: Cambot, Gypsy, Tom Servo and Crow T. Robot.",3000,https://www.imdb.com/title/tt0094517,"Comedy, Sci-Fi",tt0094517
Coupling,8.5,45000,Six best friends talk about all aspects of sex and relationships on their never-ending quest to find true love.,2000,https://www.imdb.com/title/tt0237123,"Comedy, Romance",tt0237123
Detectorists,8.5,13000,"The lives of two eccentric metal detectorists, who spend their days plodding along ploughed tracks and open fields, hoping to disturb the tedium by unearthing the fortune of a lifetime.",2014,https://www.imdb.com/title/tt4082744,Comedy,tt4082744
Alfred Hitchcock Presents,8.5,17000,"Series of unrelated short stories covering elements of crime, horror, drama, and comedy about people of different backgrounds committing murders, suicides, thefts, and other sorts of crime caused by certain motivations, perceived or not.",1955,https://www.imdb.com/title/tt0047708,"Comedy, Crime, Drama",tt0047708
Black Sun,8.5,11000,"A historical fiction drama and thriller set in the turbulent period of the late 1920s in the Balkans as a place where high politics, local interests, capital and crime all merge together.",2017,https://www.imdb.com/title/tt6108262,"Crime, Drama, Thriller",tt6108262
Brass Eye,8.5,10000,"Controversal spoof of current affairs television, and the role of celebrity in the UK.",1997,https://www.imdb.com/title/tt0118273,Comedy,tt0118273
Endeavour,8.5,24000,"Set from 1965 to 1971, the show follows Endeavour Morse in his early years as a police constable. Working alongside his senior partner DI Fred Thursday, Morse engages in a number of investigations around Oxford.",2012,https://www.imdb.com/title/tt2701582,"Crime, Drama, Mystery",tt2701582
Homicide: Life on the Street,8.5,12000,Life on the Street is an American police procedural television series chronicling the work of a fictional version of the Baltimore Police Department's Homicide Unit.,1993,https://www.imdb.com/title/tt0106028,"Crime, Drama, Mystery",tt0106028
Fullmetal Alchemist,8.5,68000,"When a failed alchemical ritual leaves brothers Edward and Alphonse Elric with severely damaged bodies, they begin searching for the one thing that can save them; the fabled philosopher's stone.",2003,https://www.imdb.com/title/tt0421357,"Animation, Action, Adventure",tt0421357
Skam,8.5,32000,"The story of young teenagers and pupils on Hartvig Nissens upper secondary school in Oslo, and their troubles, scandals and everyday life. Each season is told from a different person's point of view.",2015,https://www.imdb.com/title/tt5288312,"Drama, Romance",tt5288312
Doctor Who,8.5,216000,The further adventures in time and space of the alien adventurer known as the Doctor and their companions from planet Earth.,2005,https://www.imdb.com/title/tt0436992,"Adventure, Drama, Sci-Fi",tt0436992
Silicon Valley,8.5,141000,"Follows the struggle of Richard Hendricks, a Silicon Valley engineer trying to build his own company called Pied Piper.",2014,https://www.imdb.com/title/tt2575988,Comedy,tt2575988
Mr Inbetween,8.5,14000,"Ray Shoesmith is a father, ex-husband, boyfriend, brother and best friend, tough roles to juggle in the modern age. Especially when you're also a criminal for hire.",2018,https://www.imdb.com/title/tt7472896,"Crime, Drama",tt7472896
The Expanse,8.5,142000,"In the 24th century, a group of humans untangle a vast plot which threatens the Solar System's fragile state of detente.",2015,https://www.imdb.com/title/tt3230854,"Drama, Mystery, Sci-Fi",tt3230854
Impractical Jokers,8.5,38000,"Q, Sal, Joe and Murr are real-life best friends who love challenging each other to the most outrageous dares and stunts ever caught on hidden camera.",2011,https://www.imdb.com/title/tt2100976,"Comedy, Reality-TV",tt2100976
Ezel,8.5,31000,"Betrayed by his trusted friends and the woman he loved, Ömer Uçar returns as Ezel to exact his vengeance.",2009,https://www.imdb.com/title/tt1534360,"Crime, Drama, Thriller",tt1534360
Louie,8.5,77000,"The life of Louie C.K., a divorced comedian living in New York with two kids.",2010,https://www.imdb.com/title/tt1492966,"Comedy, Drama",tt1492966
Generation Kill,8.5,52000,"A Rolling Stone reporter, embedded with The 1st Recon Marines chronicles his experiences during the first wave of the American-led assault on Baghdad in 2003.",2008,https://www.imdb.com/title/tt0995832,"Drama, War",tt0995832
Hannibal,8.5,245000,Explores the early relationship between renowned psychiatrist Hannibal Lecter and a young FBI criminal profiler who is haunted by his ability to empathize with serial killers.,2013,https://www.imdb.com/title/tt2243973,"Crime, Drama, Horror",tt2243973
Spartacus: Gods of the Arena,8.5,134000,"In the time before the arrival of Spartacus, the House of Batiatus faces many challenges from competitors, and within its own household.",2011,https://www.imdb.com/title/tt1758429,"Action, Adventure, Biography",tt1758429
Shameless,8.5,226000,"A scrappy, feisty, fiercely loyal Chicago family makes no apologies.",2011,https://www.imdb.com/title/tt1586680,"Comedy, Drama",tt1586680
The Office,8.4,108000,The story of an office that faces closure when the company decides to downsize its branches. A documentary film crew follow staff and the manager David Brent as they continue their daily lives.,2001,https://www.imdb.com/title/tt0290978,"Comedy, Drama",tt0290978
Samurai Jack,8.4,51000,"A samurai, sent through time, fights to return home and save the world.",2001,https://www.imdb.com/title/tt0278238,"Animation, Action, Adventure",tt0278238
