title,rating,total_votes,show_desc,year,link,genre,encoded_title
Chef's Table,8.4,15000,"Chef's Table goes inside the lives and kitchens of six of the world's most renowned international chefs. Each episode focuses on a single chef and their unique look at their lives, talents and passion from their piece of culinary heaven.",2015,https://www.imdb.com/title/tt4295140,Documentary,tt4295140
The Night Of,8.4,141000,"After a night of partying with a woman he picked up, a man wakes up to find her stabbed to death and is charged with her murder.",2016,https://www.imdb.com/title/tt2401256,"Crime, Drama, Mystery",tt2401256
Whose Line Is It Anyway?,8.4,42000,Improvisational comedy competition show in which four members of the regular cast as comedians and often with guest appearances with other comedians and celebrities and members of the audience perform various comic games and sketches.,1998,https://www.imdb.com/title/tt0163507,"Comedy, Game-Show",tt0163507
Sons of Anarchy,8.4,284000,A biker struggles to balance being a father and being involved in an outlaw motorcycle club.,2008,https://www.imdb.com/title/tt1124373,"Crime, Drama, Thriller",tt1124373
I'm Alan Partridge,8.4,20000,"Alan Partridge, a failed television presenter, is now presenting a programme on local radio in Norwich. He desperately tries to revive his broadcasting career.",1997,https://www.imdb.com/title/tt0129690,Comedy,tt0129690
Spartacus,8.4,235000,"The life of Spartacus, the gladiator who lead a rebellion against the Romans. From his time as an ally of the Romans, to his betrayal and becoming a gladiator, to the rebellion he leads and its ultimate outcome.",2010,https://www.imdb.com/title/tt1442449,"Action, Adventure, Biography",tt1442449
Big Little Lies,8.4,184000,"The apparently perfect lives of upper-class mothers, at a prestigious elementary school, unravel to the point of murder when a single-mother moves to their quaint Californian beach town.",2017,https://www.imdb.com/title/tt3920596,"Crime, Drama, Mystery",tt3920596
Your Lie in April,8.4,25000,A piano prodigy who lost his ability to play after suffering a traumatic event in his childhood is forced back into the spotlight by an eccentric girl with a secret of her own.,2014,https://www.imdb.com/title/tt3895150,"Animation, Drama, Music",tt3895150
My Brilliant Friend,8.4,12000,A woman recounts the lifelong friendship and conflicts with a girl she met at primary school in Naples during the early 1950s.,2018,https://www.imdb.com/title/tt7278862,Drama,tt7278862
Black Books,8.4,57000,"Bernard Black runs a book shop, though his customer service skills leave something to be desired. He hires Manny as an employee. Fran runs the shop next door. Between the three of them many adventures ensue.",2000,https://www.imdb.com/title/tt0262150,Comedy,tt0262150
Mare of Easttown,8.4,134000,A detective in a small Pennsylvania town investigates a local murder while trying to keep her life from falling apart.,2021,https://www.imdb.com/title/tt10155688,"Crime, Drama, Mystery",tt10155688
Erased,8.4,41000,"29-year-old Satoru Fujinuma is sent back in time 18 years to prevent the events leading to his mother's death, which began with a series of kidnappings while he was in 5th grade.",2016,https://www.imdb.com/title/tt5249462,"Animation, Drama, Fantasy",tt5249462
Schitt's Creek,8.4,108000,"When rich video-store magnate Johnny Rose and his family suddenly find themselves broke, they are forced to leave their pampered lives to regroup in Schitt's Creek.",2015,https://www.imdb.com/title/tt3526078,Comedy,tt3526078
The Defiant Ones,8.4,14000,"""The Defiant Ones"" examines the partnership between Jimmy Iovine and Dr. Dre - one the son of a Brooklyn longshoreman, the other straight out of Compton - and their leading roles in a chain of transformative events in contemporary culture.",2017,https://www.imdb.com/title/tt6958022,"Documentary, Biography, Crime",tt6958022
John Adams,8.4,31000,"The life of one of the USA's Founding Fathers, its second President, and his role in the nation's first 50 years.",2008,https://www.imdb.com/title/tt0472027,"Biography, Drama, History",tt0472027
Ethos,8.4,26000,"A group of unique characters from dramatically different socio-cultural backgrounds meeting in startling circumstances in the vibrant and colorful city of Istanbul, - some by chance and some by force of will.",2020,https://www.imdb.com/title/tt11301642,"Drama, Thriller",tt11301642
Harley Quinn,8.4,22000,"The series focuses on a single Harley Quinn, who sets off to make it on her own in Gotham City.",2019,https://www.imdb.com/title/tt7658402,"Animation, Action, Adventure",tt7658402
The Knick,8.4,47000,A look at the professional and personal lives of the staff at New York's Knickerbocker Hospital during the early part of the twentieth century.,2014,https://www.imdb.com/title/tt2937900,"Drama, History",tt2937900
Delhi Crime,8.4,18000,"Based on the Nirbhaya case, Delhi Crime follows the Delhi Police investigation into the finding of the men who perpetrated this crime.",2019,https://www.imdb.com/title/tt9398466,"Crime, Drama",tt9398466
It's Okay to Not Be Okay,8.4,19000,An extraordinary road to emotional healing opens up for an selfish antisocial children's book writer and a selfless psych ward caretaker when they cross paths.,2020,https://www.imdb.com/title/tt12451520,"Comedy, Drama, Romance",tt12451520
Dr. Horrible's Sing-Along Blog,8.4,43000,An aspiring supervillain must balance his career and his pursuit of a beautiful do-gooder.,2008,https://www.imdb.com/title/tt1227926,"Short, Comedy, Musical",tt1227926
Generation War,8.4,29000,Five friends go out to war and promise each other to be back for Christmas.,2013,https://www.imdb.com/title/tt1883092,"Action, Drama, History",tt1883092
Inside No. 9,8.4,16000,"Anthology series which mixes dark humor with genres like crime, horror or drama. The show invites viewers into some very different No.9s, where the ordinary and mundane rub shoulders with the extraordinary and macabre.",2014,https://www.imdb.com/title/tt2674806,"Comedy, Drama, Horror",tt2674806
Community,8.4,247000,A suspended lawyer is forced to enroll in a community college with an eccentric staff and student body.,2009,https://www.imdb.com/title/tt1439629,Comedy,tt1439629
"Love, Death & Robots",8.4,132000,"A collection of animated short stories that span various genres including science fiction, fantasy, horror and comedy.",2019,https://www.imdb.com/title/tt9561862,"Animation, Short, Action",tt9561862
Regular Show,8.4,38000,The daily surreal adventures of a blue jay and raccoon duo that attempt to deal with their mundane jobs as groundskeepers at the local park.,2009,https://www.imdb.com/title/tt1710308,"Animation, Action, Adventure",tt1710308
The New Batman Adventures,8.4,17000,"The further and darker adventures of Batman with a new Robin, a closer association with Batgirl and the previous Robin now as Nightwing.",1997,https://www.imdb.com/title/tt0118266,"Animation, Action, Adventure",tt0118266
The Punisher,8.4,213000,"After the murder of his family, Marine veteran Frank Castle becomes the vigilante known as ""The Punisher,"" with only one goal in mind: to avenge them.",2017,https://www.imdb.com/title/tt5675620,"Action, Crime, Drama",tt5675620
Horace and Pete,8.4,16000,"Louis C.K.'s Eugene O'Neill-esque dramedic web series about two brothers, introverted Horace and mentally ill Pete, the current owners of their family's Irish bar ""Horace and Pete's"", and their dysfunctional family and friends.",2016,https://www.imdb.com/title/tt5425186,"Comedy, Drama",tt5425186
Futurama,8.4,227000,"Philip J. Fry, a pizza delivery boy, is accidentally frozen in 1999 and thawed out on New Year's Eve 2999.",1999,https://www.imdb.com/title/tt0149460,"Animation, Adventure, Comedy",tt0149460
The Prisoner,8.4,14000,"After resigning, a secret agent is abducted and taken to what looks like an idyllic village, but is really a bizarre prison. His warders demand information. He gives them nothing, but only tries to escape.",1967,https://www.imdb.com/title/tt0061287,"Drama, Mystery, Sci-Fi",tt0061287
The Venture Bros.,8.4,25000,"The bizarre escapades of pseudo-heroic scientist Dr. Rusty Venture, his competent, high-strung bodyguard, and his two overenthusiastic sons.",2003,https://www.imdb.com/title/tt0417373,"Animation, Action, Adventure",tt0417373
Wentworth,8.4,21000,"The lives of inmates and staff of Wentworth Correctional Centre as they navigate, the ups and downs of their lives working and living in the prison system.",2013,https://www.imdb.com/title/tt2433738,"Crime, Drama, Thriller",tt2433738
Jesus of Nazareth,8.4,22000,"Beginning before the Nativity and extending through the Crucifixion and Resurrection, this mini-series brings to life all of the sweeping drama in the life of Jesus, as told by the Gospels.",1977,https://www.imdb.com/title/tt0075520,"Biography, Drama, History",tt0075520
Feud: Bette and Joan,8.4,19000,"Planned anthology series centering on famous feuds, including Bette Davis and Joan Crawford that is discontinued at the moment.",2017,https://www.imdb.com/title/tt1984119,"Biography, Drama",tt1984119
Flames,8.4,28000,A teenage romance from The Timeliners that aims straight from the heart. This web-series is the story of a young romance unfolding as a chemical reaction.,2018,https://www.imdb.com/title/tt7927936,"Comedy, Drama, Romance",tt7927936
Clannad: After Story,8.4,11000,,2008,https://www.imdb.com/title/tt1298820,"Animation, Comedy, Drama",tt1298820
X-Men: The Animated Series,8.4,41000,A team of mutant superheroes fight for justice and human acceptance in the Marvel Comics universe.,1992,https://www.imdb.com/title/tt0103584,"Animation, Action, Family",tt0103584
Scenes from a Marriage,8.4,16000,Ten years within the marriage of Marianne and Johan.,1973,https://www.imdb.com/title/tt0070644,Drama,tt0070644
After Life,8.4,120000,"After Tony's wife dies, his nice-guy persona is altered into an impulsive, devil-may-care attitude; taking his old world by storm.",2019,https://www.imdb.com/title/tt8398600,"Comedy, Drama",tt8398600
Luther,8.4,132000,DCI John Luther is a near-genius murder detective whose brilliant mind can't always save him from the dangerous violence of his passions.,2010,https://www.imdb.com/title/tt1474684,"Crime, Drama, Mystery",tt1474684
Avrupa Yakasi,8.4,18000,The life and times of rather traditional Sutcuoglu family and their comedic struggles to adapt the high-profile contemporary life of Nisantasi.,2004,https://www.imdb.com/title/tt0421291,Comedy,tt0421291
