tv,season,episode_number,title,airdate,rating,total_votes,episode_desc,episode_url,encoded_title,show_desc
Africa,1,1,Kalahari,"Jan 2, 2013",8.7,589,"Deserts, like southern Africa's Kalahari and Namib, are strange and by definition are particularly dangerous and demanding environments, requiring elaborate adaptations. Some are behavioral, like tricks to steal food or even lay eggs in live hosts. other are anatomical. All the more precious is the rare water, so drinking pools are crucial for carnivores and preys. As... Read all",https://www.imdb.com/title/tt2638010/,tt2571774,"Africa, the world's wildest continent. David Attenborough takes us on an awe-inspiring journey through one of the most diverse places in the world. We visit deserts, savannas, and jungles and meet up with some of Africa's amazing wildlife."
Africa,1,2,Savannah,"Jan 9, 2013",8.4,484,"Volcanoes, some still active, shape East Africa's vast savannas, mainly consisting of grasslands where huge wildebeest and other herds roam and their annual migration steers the habitat type's complex life cycle. Some areas still remain primeval jungle, or became marshes or even hostile salt zones, yet all harbor intensive wildlife,whose lives are a merciless struggle... Read all",https://www.imdb.com/title/tt2652676/,tt2571774,"Africa, the world's wildest continent. David Attenborough takes us on an awe-inspiring journey through one of the most diverse places in the world. We visit deserts, savannas, and jungles and meet up with some of Africa's amazing wildlife."
Africa,1,3,Congo,"Jan 16, 2013",8.5,465,"The rain forest in and around equatorial Africa's Congo basin is the continent's richest and most varied environment. The abundance of food however also means extremely competition for it, while plants race to the light, using surprisingly dirty trick to 'cheat' for a spot in one of many stories from the ground to the tower-high canopy.",https://www.imdb.com/title/tt2652678/,tt2571774,"Africa, the world's wildest continent. David Attenborough takes us on an awe-inspiring journey through one of the most diverse places in the world. We visit deserts, savannas, and jungles and meet up with some of Africa's amazing wildlife."
Africa,1,4,Cape,"Jan 23, 2013",8.4,441,Southern Africa is a riot of life and color. But if it was not for two great ocean currents that sweep around and shape the continent's Great Cape it would be a desert. This episode celebrates the rejuvenating powers of the ocean.,https://www.imdb.com/title/tt2652680/,tt2571774,"Africa, the world's wildest continent. David Attenborough takes us on an awe-inspiring journey through one of the most diverse places in the world. We visit deserts, savannas, and jungles and meet up with some of Africa's amazing wildlife."
Africa,1,5,Sahara,"Jan 30, 2013",8.4,417,"The Sahara. Covering a vast swathe of Northern Africa, it is the largest desert in the world. On the surface, it appears to be a desolate empty land, but there are a few specialist species who have adapted to this harsh landscape.",https://www.imdb.com/title/tt2652692/,tt2571774,"Africa, the world's wildest continent. David Attenborough takes us on an awe-inspiring journey through one of the most diverse places in the world. We visit deserts, savannas, and jungles and meet up with some of Africa's amazing wildlife."
Africa,1,6,The Future,"Feb 6, 2013",8.1,340,"David Attenborough takes a look at the future of the world's warmest and wildest continent, which like our planet saw more change in the last half-century then ever before, and must expect even more. Problems like demography and climate change are immense, exacerbating others like poaching and habitat loss. Nevertheless he sees positive things too, like growing conser... Read all",https://www.imdb.com/title/tt2652694/,tt2571774,"Africa, the world's wildest continent. David Attenborough takes us on an awe-inspiring journey through one of the most diverse places in the world. We visit deserts, savannas, and jungles and meet up with some of Africa's amazing wildlife."
Africa,1,7,Eye to Eye,"Feb 26, 2013",7.7,26,Behind the scenes with the camera crews that spent months capturing the world's last great wilderness on film.,https://www.imdb.com/title/tt11608726/,tt2571774,"Africa, the world's wildest continent. David Attenborough takes us on an awe-inspiring journey through one of the most diverse places in the world. We visit deserts, savannas, and jungles and meet up with some of Africa's amazing wildlife."
