tv,season,episode_number,title,airdate,rating,total_votes,episode_desc,episode_url,encoded_title,show_desc
Doctor Who,1,187,Ascension of the Cybermen,"Feb 23, 2020",6.4,3500,"In the far future, the Doctor and her friends face a brutal battle across the farthest reaches of space to protect the last of the human race against the deadly Cybermen.",https://www.imdb.com/title/tt9361042/,tt0436992,The further adventures in time and space of the alien adventurer known as the Doctor and their companions from planet Earth.
Doctor Who,1,188,The Timeless Children,"Mar 1, 2020",5.1,5000,"In the epic and emotional season finale, the Cybermen are on the march. As the last remaining humans are ruthlessly hunted down, Graham, Ryan and Yaz face a terrifying fight to survive. Civilisations fall. Others rise anew. Lies are exposed, truths are revealed, battles are fought, and for the Doctor - trapped and alone - nothing will ever be the same again.",https://www.imdb.com/title/tt9361046/,tt0436992,The further adventures in time and space of the alien adventurer known as the Doctor and their companions from planet Earth.
Doctor Who,1,189,Revolution of the Daleks,"Jan 1, 2021",5.9,3100,"Robertson returns, and inadvertently gives the mutant Dalek a chance to clone itself. The Doctor escapes from her alien prison with the help of an old friend, and returns to help.",https://www.imdb.com/title/tt11892730/,tt0436992,The further adventures in time and space of the alien adventurer known as the Doctor and their companions from planet Earth.
Doctor Who,1,190,Flux: Chapter One - The Halloween Apocalypse,"Oct 31, 2021",6.8,3400,"At Halloween, all across the universe, terrifying forces are stirring. From the Arctic Circle to deep space, an ancient evil is breaking free. And in present day Liverpool, the life of Dan Lewis is about to change forever.",https://www.imdb.com/title/tt13456370/,tt0436992,The further adventures in time and space of the alien adventurer known as the Doctor and their companions from planet Earth.
Doctor Who,1,191,Flux: Chapter Two - War of the Sontarans,"Nov 7, 2021",7.2,2500,"During the Crimean War, the Doctor discovers the British army fighting a brutal alien army of Sontarans, as Yaz and Dan are thrown deeper into a battle for survival. What is the Temple of Atropos? Who are the Mouri?",https://www.imdb.com/title/tt13464078/,tt0436992,The further adventures in time and space of the alien adventurer known as the Doctor and their companions from planet Earth.
Doctor Who,1,192,"Flux: Chapter Three - Once, Upon Time","Nov 14, 2021",6.1,2200,"Time is beginning to run wild. On a planet that shouldn't exist, in the aftermath of apocalypse, the Doctor, Dan, Yaz, and Vinder face a battle to survive.",https://www.imdb.com/title/tt13469788/,tt0436992,The further adventures in time and space of the alien adventurer known as the Doctor and their companions from planet Earth.
Doctor Who,1,193,Flux: Chapter Four - Village of the Angels,"Nov 21, 2021",7.9,2400,"Devon, November 1967. A little girl has gone missing, Prof Jericho is conducting psychic experiments and in the graveyard there is one gravestone too many. Why is Medderton known as The Cursed Village and what do the Weeping Angels want?",https://www.imdb.com/title/tt13469792/,tt0436992,The further adventures in time and space of the alien adventurer known as the Doctor and their companions from planet Earth.
Doctor Who,1,194,Flux: Chapter Five - Survivors of the Flux,"Nov 28, 2021",6.2,1900,"As the forces of evil mass, the Doctor, Yaz and Dan face perilous journeys and seemingly insurmountable obstacles in their quest for survival.",https://www.imdb.com/title/tt13469800/,tt0436992,The further adventures in time and space of the alien adventurer known as the Doctor and their companions from planet Earth.
Doctor Who,1,195,Flux: Chapter Six - The Vanquishers,"Dec 5, 2021",5.4,1900,"In the final epic chapter in the story of the Flux, all hope is lost. The forces of darkness are in control. But when the monsters have won, who can you count upon to save the universe?",https://www.imdb.com/title/tt13469804/,tt0436992,The further adventures in time and space of the alien adventurer known as the Doctor and their companions from planet Earth.
Doctor Who,1,196,Eve of the Daleks,"Jan 1, 2022",6.8,1700,"Sarah owns and runs ELF storage, and Nick is a customer who visits his unit every year on New Year's Eve. This year, however, their night turns out to be a little different than planned.",https://www.imdb.com/title/tt13469818/,tt0436992,The further adventures in time and space of the alien adventurer known as the Doctor and their companions from planet Earth.
