tv,season,episode_number,title,airdate,rating,total_votes,desc,encoded_title
House,1,1,Pilot,"Nov 16, 2004",8.6,4957,Young kindergarten teacher Rebecca Adler collapses in her classroom after losing intelligible speech while teaching students.,tt0412142
House,1,2,Paternity,"Nov 23, 2004",8.2,3575,"The team helps a high school boy (16) who has double vision and night terrors. (Clinic Cases: Unvaccinated baby, man with boil on leg.)",tt0412142
House,1,3,Occam's Razor,"Nov 30, 2004",8.3,3364,"A college boy whose low blood pressure does not respond with IV fluids piques House's curiosity. Clinic Cases: A woman who had a cold last week, man with a sore throat, woman whose leg hurts after running 6 miles, a boy and his MP3 Player.",tt0412142
House,1,4,Maternity,"Dec 7, 2004",8.4,3255,A nightmare scenario hits Princeton Plainsboro when babies in the maternity ward are hit by a potentially fatal epidemic. Clinic Cases: Woman with a parasite!,tt0412142
House,1,5,Damned If You Do,"Dec 14, 2004",8.2,3139,A nun suffering from acute dermatitis and asthma treated by House with possibly the wrong medication comes dangerously close to death.,tt0412142
House,1,6,The Socratic Method,"Dec 21, 2004",8.5,3086,"A 38-year-old mother, apparently suffering from thrombosis, alcoholism and schizophrenia, has only her underage 15-year-old son as caregiver.",tt0412142
House,1,7,Fidelity,"Dec 28, 2004",8.2,3017,"A woman comes down with symptoms of African sleeping sickness, but there seems to be no way she could have contracted it. House and his aides must ask a few tough questions and make some tough decisions in order to try to save her.",tt0412142
House,1,8,Poison,"Jan 25, 2005",8.1,2878,"A high school boy has hallucinations and collapses during an exam. When he does not respond to treatments, and the normal tests are negative, Foreman presents the case to House. Clinic Cases: A happy old lady.",tt0412142
House,1,9,DNR,"Feb 1, 2005",8.8,3302,"A famous jazz trumpeter, diagnosed with ALS, signs a DNR form, but because House believes the diagnosis wrong, he breaks the law by resuscitating him.",tt0412142
House,1,10,Histories,"Feb 8, 2005",8.5,2978,A delusional homeless woman is found unconscious in an acid house exhibiting a variety of symptoms which Foreman thinks she's faking.,tt0412142
House,1,11,Detox,"Feb 15, 2005",8.7,3085,A girl crashes a Porsche after her boyfriend starts coughing up blood and continues to have unexplained bleeds. Clinic Cases: Cuddy gives House a month off clinic duties if he can spend a week off his pain meds.,tt0412142
House,1,12,Sports Medicine,"Feb 22, 2005",8.0,2688,"A detoxed sports star about to make his comeback breaks his arm due to brittle bones. Clinic Cases: Woman with leg pain, man trying to remove his contact lenses, a dentist with various issues, and a hung over teenager - all in 70 seconds.",tt0412142
House,1,13,Cursed,"Mar 1, 2005",8.2,2730,A young boy's fever lasts nearly a week after a Ouija board predicts he will die. Clinic Cases: Chase's case of a man with numb fingers.,tt0412142
House,1,14,Control,"Mar 15, 2005",8.7,2919,Can House save a high powered female executive from the same problem that has left him in constant pain? A new head of the hospital board could cause problems. Clinic cases: A boy and his mute dad.,tt0412142
House,1,15,Mob Rules,"Mar 22, 2005",8.0,2636,A Mob informer collapses before trial. Is he faking or is he really in a coma? Clinic Cases: A pair of brothers come in when the youngster gets toys stuck up his nose.,tt0412142
House,1,16,Heavy,"Mar 29, 2005",8.4,2631,"A morbidly obese ten-year-old girl has a heart attack, and her mother insists that House and his team look past her weight to find the diagnosis. Meanwhile, Vogler pressures House to fire a member of his staff. Clinic Patients: Unidentified man with an infected pierced scrotum; overweight woman with a 30-pound tumor on her ovaries who refuses to have it removed, because she worries she will be unattractive.",tt0412142
House,1,17,Role Model,"Apr 12, 2005",8.6,2740,"An ambitious and charismatic Black senator campaigning for the presidency falls ill from a mysterious malady, possibly AIDS.",tt0412142
House,1,18,Babies & Bathwater,"Apr 19, 2005",8.9,3010,"While House and his team scramble to discover what's causing brain and kidney dysfunction in a pregnant woman, Vogler is on the warpath to get House fired.",tt0412142
House,1,19,Kids,"May 3, 2005",8.3,2679,"During a meningitis outbreak which overwhelms the clinic, House is drawn to a single patient: a 12-year-old competitive diver whose symptoms don't quite match everyone else's.",tt0412142
House,1,20,Love Hurts,"May 10, 2005",8.3,2729,"House has to deal with his promised dinner date with Cameron, a mysterious stroke in a clinic patient and a libidinous senior citizen.",tt0412142
House,1,21,Three Stories,"May 17, 2005",9.6,7186,"House's ex Stacy Warner asks him to treat her husband. House takes over a diagnostics class for a day and presents the class with three case studies of leg pain. As House tells his story and the class gradually fills up with listeners, the class learns a lot about how to be better doctors, and Chase, Foreman and Cameron learn some important details of House's past.",tt0412142
House,1,22,Honeymoon,"May 24, 2005",8.7,2864,House doses his ex-girlfriend's husband in order to get him into hospital after she begs House to treat him. Is House treating Mark differently in order to get back at Stacy for his leg?,tt0412142
House,2,1,Acceptance,"Sep 13, 2005",8.4,2767,House treats a patient on death row while Dr. Cameron avoids telling a patient she has a terminal illness.,tt0412142
House,2,2,Autopsy,"Sep 20, 2005",9.2,4048,"A very brave and mature 9-year-old girl has terminal cancer, but that is not what the problem seems to be.",tt0412142
House,2,3,Humpty Dumpty,"Sep 27, 2005",8.0,2492,"Cuddy joins the team after her handyman falls off of her roof and begins to develop bizarre symptoms. Clinic Cases: African American man who objects to ""minority meds.""",tt0412142
House,2,4,TB or Not TB,"Nov 1, 2005",8.1,2512,"A doctor campaigns against the epidemic of TB in Africa, possibly at the risk of his own life.",tt0412142
House,2,5,Daddy's Boy,"Nov 8, 2005",8.1,2460,"The team takes care of a student with inexplicable electrical shocks, and House's parents visit.",tt0412142
House,2,6,Spin,"Nov 15, 2005",7.9,2396,"Star bicycle racer collapses, and the team must come up with a diagnosis after the patient admits to blood doping. House and Stacy continue sparring with each other. Clinic Case: Flight attendant poisons himself with gum.",tt0412142
House,2,7,Hunting,"Nov 22, 2005",8.3,2455,"After being accused of assaulting a sick man, House is forced to take on his case. However, despite the fact that he has AIDS, it's clearly not what's killing him.",tt0412142
House,2,8,The Mistake,"Nov 29, 2005",8.9,2858,"Chaos ensues after Chase's negligence leads to the death of a female patient. Now, after an inquiry from the hospital board, and a subpoena from the patient's brother, it's up to Stacey to protect Chase's career, as well as House's.",tt0412142
House,2,9,Deception,"Dec 13, 2005",8.5,2409,"A woman collapses at an off-track betting parlor in front of House, and he must battle his new boss to find her diagnosis.",tt0412142
House,2,10,Failure to Communicate,"Jan 10, 2006",8.6,2471,"When a famous writer is brought in with language difficulties, House must assist via phone while waiting for a delayed plane.",tt0412142
House,2,11,Need to Know,"Feb 7, 2006",8.2,2358,"House and the team must determine what is causing an increasingly deceitful patient's muscle flailing. Stacy makes a decision, and Cameron avoids a test.",tt0412142
House,2,12,Distractions,"Feb 14, 2006",8.6,2455,"A patient with 40% body burns and inexplicable cardiac and neurological signs is treated by the team, while House pursues disproving an old enemy's medical study.",tt0412142
House,2,13,Skin Deep,"Feb 20, 2006",8.7,2730,"The search for the cause of a supermodel's symptoms causes intense feelings among the team, as new facts are revealed. Meanwhile, House experiences increasing pain in his leg.",tt0412142
House,2,14,Sex Kills,"Mar 7, 2006",8.4,2431,House and the team struggle to diagnose one patient in order to save another. Clinic Case: College student claims he has the hots for heifers.,tt0412142
House,2,15,Clueless,"Mar 28, 2006",8.5,2405,House must diagnose a man who became sick and experienced difficulty breathing during sex-play but all tests keep returning normal. Wilson experiences close-up what living with House is like. Clinic case: Herpes,tt0412142
House,2,16,Safe,"Apr 4, 2006",8.8,2668,6 months after a teenage girl crushes her chest in a car accident and receives a heart transplant she goes into anaphylactic shock in her clean room bedroom after her boyfriend almost kisses her and discovers something on her arm.,tt0412142
House,2,17,All In,"Apr 11, 2006",9.0,3061,"On a class field trip, a teacher discovers that her six-year-old student, Ian, is bleeding profusely. Dr. House thinks Ian has the same unknown disease that killed an elderly patient of his years ago.",tt0412142
House,2,18,Sleeping Dogs Lie,"Apr 18, 2006",8.2,2348,Cameron gets mad at Foreman because Foreman steals his idea for an article. The case of the week: a lesbian woman has not slept for ten days despite taking a bottle of sleeping pills.,tt0412142
House,2,19,House vs. God,"Apr 25, 2006",8.6,2671,"House takes on a teenage faith healer, Wilson desperately wants into a poker game, and tensions escalate between Cameron and Foreman.",tt0412142
House,2,20,Euphoria: Part 1,"May 2, 2006",9.1,3300,"A police officer in critical condition has bizarre symptoms, and Dr. Foreman finds himself in an unpleasant situation.",tt0412142
House,2,21,Euphoria: Part 2,"May 3, 2006",9.3,3630,House tries radical procedures to save Foreman's life. Foreman's father visits.,tt0412142
House,2,22,Forever,"May 9, 2006",8.1,2293,"A dad kisses his wife and baby goodbye before leaving for work, pukes and returns to find his wife with seizure in the bathtub and the baby under water. Foreman is back but changed.",tt0412142
House,2,23,Who's Your Daddy?,"May 16, 2006",7.8,2330,"House cares for a young Katrina victim, the alleged daughter of an old friend of his. He supposedly she had hallucinations because of the heart, but it turns out not to be the cause.House discovers a disease that his grandfather had.",tt0412142
House,2,24,No Reason,"May 23, 2006",9.5,4820,An old patient of House comes back and seeks revenge upon him in the form of gunshot.,tt0412142
House,3,1,Meaning,"Sep 5, 2006",8.9,2987,"Richard, a husband and father living with brain cancer, drives his wheelchair into a pool at a family BBQ. Everyone but his son think that it was suicide from the pain but House will stop at nothing to figure out his true ailment.",tt0412142
House,3,2,Cane and Able,"Sep 12, 2006",8.4,2424,"House is affected by the fact that he thinks he didn't solve the last case while a young boy, who believes aliens tortured him, is brought in.",tt0412142
House,3,3,Informed Consent,"Sep 19, 2006",8.6,2544,House and his team face a lot of moral dilemmas when a patient wants them to help him end his life.,tt0412142
House,3,4,Lines in the Sand,"Sep 26, 2006",9.0,3104,"A ten-year-old boy begins screaming in pain, but nobody knows why, because he is autistic and cannot explain. House refuses to use his office because it has new carpet.",tt0412142
House,3,5,Fools for Love,"Oct 31, 2006",8.4,2301,"A husband and wife being treated cause Foreman to ponder the strength of true love, and House abuses one too many patients with potentially devastating repercussions.",tt0412142
House,3,6,Que Será Será,"Nov 7, 2006",8.2,2329,"An obese man in a coma presents treatment challenges, but finding out what's wrong with him may be the most challenging test of all. Elsewhere, Tritter ramps up his vendetta against House.",tt0412142
House,3,7,Son of Coma Guy,"Nov 14, 2006",8.9,2903,"When the son of a man in a vegetative state starts going into a coma, the vegetative man is reawakened chemically by House, who hopes to get some clues to the son's problems.",tt0412142
House,3,8,Whac-A-Mole,"Nov 21, 2006",8.1,2224,"A young man collapses at his job, and House makes a game of establishing the diagnosis until things turn critical, and Tritter increases the pressure on Wilson.",tt0412142
House,3,9,Finding Judas,"Nov 28, 2006",8.5,2316,"While a little girl's life and limbs are in jeopardy, Tritter becomes more manipulative and House suffers withdrawal.",tt0412142
House,3,10,Merry Little Christmas,"Dec 12, 2006",8.7,2438,"Wilson presents the deal to House and then convinces Cuddy to back him up, meanwhile the team is flummoxed by a patient's condition and various members keep seeking out House for his opinion even though he may not be prepared to assist.",tt0412142
House,3,11,Words and Deeds,"Jan 9, 2007",8.6,2400,"House checks himself into rehab just before his trial, but a different game entirely may be afoot. Elsewhere, the team attempts to treat a firefighter who can't stop shivering.",tt0412142
House,3,12,"One Day, One Room","Jan 30, 2007",9.1,4952,"Stuck with clinic duty, House almost wishes he had the boring patients back after he encounters a young woman with an STD and the need to talk.",tt0412142
House,3,13,Needle in a Haystack,"Feb 6, 2007",8.0,2255,"A young man is stricken during sex with his girlfriend, and House must determine why his organs are suddenly shutting down. Finding the cause is like looking for a needle in a haystack.",tt0412142
House,3,14,Insensitive,"Feb 13, 2007",8.8,2574,"On Valentine's Day, House meddles in relationships as he works to diagnose a teenager who has a genetic inability to feel pain.",tt0412142
House,3,15,Half-Wit,"Mar 6, 2007",9.1,3205,"House struggles to find out why a pianist savant is losing his ability to play. Ultimately, a decision must be made as to how much brain is necessary for a normal quality of life.",tt0412142
House,3,16,Top Secret,"Mar 27, 2007",8.1,2256,"A patient whose relative has called in a favor with Cuddy presents with nonspecific minor symptoms that turn life-threatening, but House is distracted by a dream and an inability to urinate.",tt0412142
House,3,17,Fetal Position,"Apr 3, 2007",8.5,2447,"When a pregnant woman has a stroke, the team is at a loss after all tests reveal nothing, but when her organs start shutting down Cuddy takes over the case.",tt0412142
House,3,18,Airborne,"Apr 10, 2007",9.0,2975,"House and Cuddy are flying back to the US from an international conference in Singapore. While en route a mysterious disease strikes one passenger and an epidemic unfolds, causing House to diagnose in midair since they have missed the halfway mark by passing the north pole. Back in Princeton, Wilson and House's lackeys have a confusing case of what is ailing a woman who came into the clinic and proceeded to have a seizure.",tt0412142
House,3,19,Act Your Age,"Apr 17, 2007",8.2,2196,"A young girl is ailed with diseases that usually strike people much older than her 6 years of age. But before House can diagnose her, her brother starts exhibiting the same symptoms she was admitted with. During all of this House gives Wilson tickets that a patient had given to him for a play. Ensuing a discussion on why men take women to plays. Wilson decides to take Cuddy and the tug of war with House for her affections begins, although Cuddy insists that she only went with Wilson as a friend.",tt0412142
House,3,20,House Training,"Apr 24, 2007",8.3,2244,"The cause of a woman's TIA stumps the team, and Foreman's family visits.",tt0412142
House,3,21,Family,"May 1, 2007",8.4,2177,"Wilson is preparing his 14-year-old patient, Nick, for a bone marrow transplant when the donor, Nick's younger brother Matty, suddenly starts sneezing. Since Nick's immune system has been destroyed by the chemotherapy for his cancer, he cannot risk a marrow donation from Matty while Matty is ill. House decides that the fastest way to find out what's wrong with Matty is to make him worse. As the boys get sicker and sicker, House and his team race to cure Matty before both brothers die. Meanwhile, House battles Hector (his newly adopted dog) for supremacy and Foreman ...",tt0412142
House,3,22,Resignation,"May 8, 2007",8.4,2204,A college girl suddenly coughs up blood during karate class. Foreman resigns. A vegan couple has problems with floating poop. House secretly drugs Wilson with amphetamine.,tt0412142
House,3,23,The Jerk,"May 15, 2007",8.5,2279,"When a teenage chess-player assaults his opponent, the team struggles to determine whether the problem is organic or psychological. Clinic Cases: Spotted sunburn.",tt0412142
House,3,24,Human Error,"May 29, 2007",8.9,2771,"A couple risk their lives getting from Cuba to see House, but his preoccupation with staff issues may cost the woman her life.",tt0412142
House,4,1,Alone,"Sep 25, 2007",9.0,3080,"House is off his game without the team, and Wilson uses an extreme tactic to force him into interviews.",tt0412142
House,4,2,The Right Stuff,"Oct 2, 2007",8.8,2697,"House is forced to choose a new staff... and gathers 40 applicants to start narrowing down the field. Meanwhile, an Air Force pilot wants House to treat her secretly so she doesn't ruin her chances of becoming an astronaut.",tt0412142
House,4,3,97 Seconds,"Oct 9, 2007",8.8,2516,"Down to 10 candidates for his team, House splits them into 2 groups to diagnose a patient whose short lifespan has been made even shorter. Foreman leads his own team to diagnose a patient at his new workplace.",tt0412142
House,4,4,Guardian Angels,"Oct 23, 2007",8.5,2283,"A woman seeing her dead mother stumps the recruits, especially once she begins seeing a recent victim.",tt0412142
House,4,5,Mirror Mirror,"Oct 30, 2007",8.8,2636,A victim of a mugging presents with neurological symptoms and begins to mirror the behaviors of his doctors. Foreman joins the new fellows in seeking a diagnosis; Cameron and Chase takes bets on whom House will fire next.,tt0412142
House,4,6,Whatever It Takes,"Nov 6, 2007",8.6,2393,"House is taken by jet to help diagnose a dying CIA agent, leaving Foreman in charge of the team trying to find out why a young woman passed out after a drag car race.",tt0412142
House,4,7,Ugly,"Nov 13, 2007",8.3,2284,House and his team are hampered by a reality television crew whilst battling over possible diagnoses for a craniofacial surgery patient.,tt0412142
House,4,8,You Don't Want to Know,"Nov 20, 2007",8.6,2284,"A magician's heart stops during a performance. At first House dismisses the case, but later changes his mind when complications arise. House has a contest to determine the next one to leave the team.",tt0412142
House,4,9,Games,"Nov 27, 2007",8.6,2419,"House treats a rock musician, and some of the candidates have to get past their personal biases, Wilson misdiagnoses a patient, and the winners are named.",tt0412142
House,4,10,It's a Wonderful Lie,"Jan 29, 2008",8.4,2217,"House is equally obsessed with a mother and daughter who don't lie, and using Christmas to create discord among the team members.",tt0412142
House,4,11,Frozen,"Feb 3, 2008",9.2,3278,"When a researcher at a South Pole base becomes ill, House must diagnose the case at a distance. Meanwhile, House tries to find out who Wilson is dating, and his new staff tries to get him cable.",tt0412142
House,4,12,Don't Ever Change,"Feb 5, 2008",8.1,2190,"A woman collapses at her wedding. She led a different life style before her marriage, House insists she hasn't changed. Wilson starts dating Amber.",tt0412142
House,4,13,No More Mr. Nice Guy,"Apr 28, 2008",8.1,2103,"House encounters a patient who is too nice for his own good, which is a bigger problem than his emergency room diagnosis; and House competes with Amber for Wilson's attention.",tt0412142
House,4,14,Living the Dream,"May 5, 2008",8.3,2185,"House finds himself at odds with his team when he becomes convinced that an actor on his favorite soap, ""Prescription Passion,"" has a serious medical condition.",tt0412142
House,4,15,House's Head,"May 12, 2008",9.8,9265,"A bus that House was riding crashes. House claims there's a victim on the bus who is dying, but not from the bus accident. He stops at nothing to figure out who the patient is and what is ailing him/her.",tt0412142
House,4,16,Wilson's Heart,"May 19, 2008",9.8,8719,"The team works to save someone close to a central character's heart. The key is inside House's head, but he is in a bad way himself.",tt0412142
House,5,1,Dying Changes Everything,"Sep 16, 2008",8.4,2459,"House's preoccupation with Wilson leaves his team without direction and endangers the patient, a female whose exhaustive work schedule and demanding boss may have caused her condition.",tt0412142
House,5,2,Not Cancer,"Sep 23, 2008",8.2,2174,"Years after receiving body parts from an organ donor, five out of six recipients die within a few months, but not from organ rejection. House and the team race against time to figure out why before the final surviving recipient, a young woman who received the donor's cornea, mysteriously dies as well. House retains a comical private investigator to investigate patients, doctors, and his estranged friend, Wilson.",tt0412142
House,5,3,Adverse Events,"Sep 30, 2008",8.1,2070,"House's investigator gets information on everyone, which House uses to stir the pot of their lives while the team tries to cure a portraitist whose artistic view now looks like Picasso.",tt0412142
House,5,4,Birthmarks,"Oct 14, 2008",9.0,2739,"House tries every delaying tactic available when Wilson forces him to attend his father's funeral. Meanwhile, the team tries to find the cause of a young woman's abdominal pain and hemorrhage that occurred in China.",tt0412142
House,5,5,Lucky Thirteen,"Oct 21, 2008",8.5,2352,"Thirteen's one night stand collapses at her apartment, and her symptoms are so misleading that the diagnosis may be terminal. Meanwhile, revelation about Wilson and Thirteen occupy House.",tt0412142
House,5,6,Joy,"Oct 28, 2008",8.6,2262,"House takes on a case where the patient has unexplained blackouts, and his daughter may hold the key to the diagnosis. Meanwhile, Cuddy prepares for her new arrival until there are complications with the birth mother.",tt0412142
House,5,7,The Itch,"Nov 11, 2008",8.2,2045,House takes time to dabble in Cameron and Chase's love life while he treats an agoraphobic patient she's brought to the team.,tt0412142
House,5,8,Emancipation,"Nov 18, 2008",8.0,1965,"The team tries to treat a patient who keeps lying to them, and Foreman exerts some independence.",tt0412142
House,5,9,Last Resort,"Nov 25, 2008",8.9,2920,"A person takes House, Thirteen and others as hostages. He's seen several doctors but none have found what ails him. As they work towards finding a solution, Thirteen makes decisions which leads her to think about her own condition.",tt0412142
House,5,10,Let Them Eat Cake,"Dec 2, 2008",8.2,2033,The drug trial brings back memories for Thirteen; Kutner and Taub scramble as they try to salvage a scam and save the team's patient whose gastric bypass may not have saved her life.,tt0412142
House,5,11,Joy to the World,"Dec 9, 2008",8.4,2243,"A teenager collapses on stage, and the outcome will lead to a surprise for Cuddy. Wilson convinces House to be nice to his patients during the holidays. Foreman and Thirteen have issues when a trial patient drops from the program.",tt0412142
House,5,12,Painless,"Jan 19, 2009",8.1,2011,House treats a patient who's worn out by chronic pain. Cuddy tries to do her job and take care of her new child. Foreman and Thirteen's relationship stalls.,tt0412142
House,5,13,Big Baby,"Jan 26, 2009",8.0,1920,"House maneuvers against a measured Cameron when she takes over Cuddy's duties, Foreman faces an ethical dilemma, and Cuddy has trouble bonding with the baby.",tt0412142
House,5,14,The Greater Good,"Feb 2, 2009",8.0,1919,"A physician who gave up her career comes in for treatment, leading to tense encounters with the team. Meanwhile, Cuddy exacts revenge and Foreman's choice has devastating consequences.",tt0412142
House,5,15,Unfaithful,"Feb 16, 2009",8.4,2126,"House treats a priest who's lost his faith, issues an ultimatum to Foreman and Thirteen, and plays with Cuddy's desire to have him attend - or is it not attend? - her baby's naming ceremony.",tt0412142
House,5,16,The Softer Side,"Feb 23, 2009",8.5,2144,"House's team resents being made complicit in a web of lies parents have told their son when he's brought in for treatment that may be related to his intersexuality. Meanwhile, no one's content that House is happy.",tt0412142
House,5,17,The Social Contract,"Mar 9, 2009",8.7,2227,"The team tries to diagnose a condition that leaves the patient saying anything that he thinks, no matter whom it hurts, and Wilson raises House's antennae when he passes up a monster truck rally.",tt0412142
House,5,18,Here Kitty,"Mar 16, 2009",8.2,2075,House treats a patient who is convinced she's dying because of a death predicting cat. Meanwhile Taub catches up with an old High School classmate and contemplates leaving the team.,tt0412142
House,5,19,Locked In,"Mar 30, 2009",9.1,3275,"House is injured in a motorcycle accident. While recovering, he finds an accident victim suffering from a brain injury. House tries to prove the brain damage caused the accident, not vice versa, so he can treat the patient.",tt0412142
House,5,20,Simple Explanation,"Apr 6, 2009",9.2,3518,"Taub treats a patient whose dying husband gets better as she becomes sicker, while the rest of the team deals with a devastating loss.",tt0412142
House,5,21,Saviors,"Apr 13, 2009",8.4,2097,House worries he's lost his mojo when he can't determine the reason for Cameron and Wilson's changed behaviors or his new patient's diagnosis.,tt0412142
