tv,season,episode_number,title,airdate,rating,total_votes,episode_desc,encoded_title,show_desc
Human Planet,1,1,Oceans: Into the Blue,"Jan 13, 2011",8.6,469,"Nearly all human populations in coastal areas interact intensively with the sea. The food harvest is enormous, varied and obtained in various, sometimes ingenious ways, including cooperation with wild dolphins. Dangers and scarcity worsen for environmental reasons, climate change bodes even worse. Aquatic sports are also culturally important, sometimes even defining.",tt1806234,"Like all life forms, humanity partially adapts to types of natural environment, yet also tends to change them. Each episode examines how life differs for men and nature in some type of environment, from Arctic to desert and jungle, from coasts to mountains."
Human Planet,1,2,Deserts: Life in the Furnace,"Jan 20, 2011",8.5,392,"Deserts cover a third of the earth's land mass, yet harbor only some 300,000 inhabitants, many of which are (semi-)nomadic hunters/herdsmen, making navigation and adapted animals, such as camels, vital. The only 7,000 years old Sahara, the planet's vastest sand-pan, counts many tribes. The stony Gobi enjoys melting snow, wind-transported in all the way from Siberia, b... Read all",tt1806234,"Like all life forms, humanity partially adapts to types of natural environment, yet also tends to change them. Each episode examines how life differs for men and nature in some type of environment, from Arctic to desert and jungle, from coasts to mountains."
Human Planet,1,3,Arctic: Life in the Deep Freeze,"Jan 27, 2011",8.8,394,"In the vast icy wastes of the Arctic very little grows. It's dark for months in the winter and the freezing temperatures make it particularly inhospitable. Yet four million people live there thanks to ingenious survival techniques passed down through generations. In Greenland, where food is hard to come by and dogs are a crucial means of transport, Amos and his son Ka... Read all",tt1806234,"Like all life forms, humanity partially adapts to types of natural environment, yet also tends to change them. Each episode examines how life differs for men and nature in some type of environment, from Arctic to desert and jungle, from coasts to mountains."
Human Planet,1,4,Jungles: People of the Trees,"Feb 3, 2011",8.8,389,"Although a mall part of earth's landmass, tropical rain forests contain half the animal species, mainly on altitudes out of human reach, losing 100 a day, often undiscovered, trough rapid wood-cut, clearing for agriculture etcetera. The rare surviving native tribal jungle cultures go to great lengths to remain in ecological harmony with wildlife and cope with dangers ... Read all",tt1806234,"Like all life forms, humanity partially adapts to types of natural environment, yet also tends to change them. Each episode examines how life differs for men and nature in some type of environment, from Arctic to desert and jungle, from coasts to mountains."
Human Planet,1,5,Mountains: Life in Thin Air,"Feb 10, 2011",8.7,338,"Life in the mountains demands elaborate adaptations, for despite the extreme biological diversity people often have little choice of meat supply, despite elaborate hunting methods such as nets in clearings to lure giant bats. In developed regions, modern technology helps control avalanches. Relative isolation comes at a price, as for health care, and leads to bizarre ... Read all",tt1806234,"Like all life forms, humanity partially adapts to types of natural environment, yet also tends to change them. Each episode examines how life differs for men and nature in some type of environment, from Arctic to desert and jungle, from coasts to mountains."
Human Planet,1,6,Grasslands: The Roots of Power,"Feb 17, 2011",8.5,327,"Grass lands cover vast plains, such as savanna, prairies and pampas. The many, almost indestructible grass species, for various types of soil and other conditions, feed huge herds, whose migrations are followed by many predators and (semi-)nomadic peoples, such as the Mongol master horsemen. Some still practice hunting-gathering, such as the Khoisan, or traditional 'n... Read all",tt1806234,"Like all life forms, humanity partially adapts to types of natural environment, yet also tends to change them. Each episode examines how life differs for men and nature in some type of environment, from Arctic to desert and jungle, from coasts to mountains."
Human Planet,1,7,Rivers: Friend and Foe,"Feb 24, 2011",8.6,323,"Man always was attracted by rivers, not unlike seas, for water, fishing, irrigation, transport. And he deals in many ways with their dangers, ranging from torrents, frost and perilous crossing to floods. Most lack moder technology, hence are reduced to minimal control, rather adapting to the tide then controlling it.",tt1806234,"Like all life forms, humanity partially adapts to types of natural environment, yet also tends to change them. Each episode examines how life differs for men and nature in some type of environment, from Arctic to desert and jungle, from coasts to mountains."
Human Planet,1,8,Cities: Surviving the Urban Jungle,"Mar 3, 2011",8.1,318,"Urban environments are man-made, so human design seems totally to overtake wildlife habitats. Yet animals abound in cities and suburbs, many as pets or working, but others exempt by religion or even able to pursue their natural life with some fancy adapting, as many animals do in the wild.",tt1806234,"Like all life forms, humanity partially adapts to types of natural environment, yet also tends to change them. Each episode examines how life differs for men and nature in some type of environment, from Arctic to desert and jungle, from coasts to mountains."
