tv,season,episode_number,title,airdate,rating,total_votes,episode_desc,encoded_title,show_desc
Shameless,1,75,Home Sweet Homeless Shelter,"Oct 16, 2016",8.5,1400,"Kevin, Veronica and Svetlana start a topless maid service. Frank makes new friends at the shelter to replace his old family. Plus, Debbie's lifestyle comes to an end; Carl gets a gonorrhea scare; and business at Patsy's hits the skids.",tt1586680,"A scrappy, feisty, fiercely loyal Chicago family makes no apologies."
Shameless,1,76,I Am A Storm,"Oct 23, 2016",8.6,1500,"Frank worries that he and his new family will lose their Home for the Homeless shelter, so he plans a little goodwill for the neighborhood. Meanwhile, Fiona drums up business by throwing a speakeasy party at Patsy's Pies.",tt1586680,"A scrappy, feisty, fiercely loyal Chicago family makes no apologies."
Shameless,1,77,Own Your Sh*t,"Oct 30, 2016",8.1,1400,"Frank learns that a billionaire philanthropist has bought the homeless shelter and he and his clan can stay. Meanwhile, Fiona gets smart financial advice from a Tinder hookup as Ian struggles with his feelings for Trevor.",tt1586680,"A scrappy, feisty, fiercely loyal Chicago family makes no apologies."
Shameless,1,78,The Defenestration of Frank,"Nov 6, 2016",8.5,1400,"Fiona sees opportunity in a laundromat for sale and decides to invest. Frank revels in the good fortune of his scam, but the troops catch a whiff of foul play. Meanwhile, Kev and V discover a shocking secret about Svetlana's father.",tt1586680,"A scrappy, feisty, fiercely loyal Chicago family makes no apologies."
Shameless,1,79,You'll Never Ever Get a Chicken in Your Whole Entire Life,"Nov 13, 2016",8.2,1400,"Fiona learns that owning a laundromat is costlier than expected. Frank helps Liam get into a plush new school after his old one is permanently shut down. Meanwhile, Debbie cleans up her act and grows closer to Neil.",tt1586680,"A scrappy, feisty, fiercely loyal Chicago family makes no apologies."
Shameless,1,80,"You Sold Me the Laundromat, Remember?","Nov 20, 2016",9.1,1700,"Fiona takes a DIY approach to renovating the laundromat. Lip agrees to go before the school board in hopes of getting reinstated. Meanwhile, Kev's trust in Svetlana wanes even further when the titty van goes missing.",tt1586680,"A scrappy, feisty, fiercely loyal Chicago family makes no apologies."
Shameless,1,81,Ouroboros,"Nov 27, 2016",8.6,1400,"Monica is back. And her first task is to help Debbie get back Franny. Meanwhile, Frank tries to avoid her, Ian has his first fight with Trevor, Lip tries to mask his relapsing alcoholism and Fiona's laundromat gets a bad review.",tt1586680,"A scrappy, feisty, fiercely loyal Chicago family makes no apologies."
Shameless,1,82,Ride or Die,"Dec 4, 2016",8.9,1700,"Fiona, facing mounting issues, contemplates Margo's offer to buy the laundromat. Meanwhile, Ian tries to deal with the fact that Mickey might be out of prison and Kev and V take matters into their own hands after Svetlana's betrayal.",tt1586680,"A scrappy, feisty, fiercely loyal Chicago family makes no apologies."
Shameless,1,83,Happily Ever After,"Dec 11, 2016",9.3,1900,"Frank and Monica have an interesting proposal for the kids. Lip buckles under pressure from Debbie to get his sobriety under control. Meanwhile, Fiona sees a business opportunity as Kev and V attempt to start a new chapter.",tt1586680,"A scrappy, feisty, fiercely loyal Chicago family makes no apologies."
Shameless,1,84,Requiem for a Slut,"Dec 18, 2016",9.3,2000,"The Gallaghers grapple with the loss of one of their own. As Lip takes steps to improve his future, Debbie, Carl and Liam get roped into Frank's new scheme. Meanwhile, Kev and V get their revenge on Svetlana.",tt1586680,"A scrappy, feisty, fiercely loyal Chicago family makes no apologies."
Shameless,1,85,We Become What We... Frank!,"Nov 5, 2017",8.5,1400,The Gallaghers find themselves with money to burn as Carl sells their inheritance. Fiona focuses on her new apartment building; Lip deals with his sobriety; and Frank emerges out of a meth-induced haze to make amends.,tt1586680,"A scrappy, feisty, fiercely loyal Chicago family makes no apologies."
Shameless,1,86,Where's My Meth?,"Nov 12, 2017",8.2,1100,"Frank joins the workforce for the first time. Meanwhile, Fiona grapples with evicting a tenant; Lip works out a plan to sabotage Charlie; Ian and Carl make a troubling discovery about Monica; and Kev prepares to go under the knife.",tt1586680,"A scrappy, feisty, fiercely loyal Chicago family makes no apologies."
Shameless,1,87,God Bless Her Rotting Soul,"Nov 19, 2017",9.0,1400,"A meth dealer threatens the Gallaghers, forcing Ian, Carl, Lip and Debbie to find a way to pay him off without involving Fiona. Meanwhile, Fiona battles a vindictive tenant; Lip cares for Professor Youens; and Frank attains sainthood.",tt1586680,"A scrappy, feisty, fiercely loyal Chicago family makes no apologies."
Shameless,1,88,F**k Paying It Forward,"Nov 26, 2017",8.5,1100,"A blast from the past shakes up Fiona's view of her life. Meanwhile, Frank gets involved with Liam's school PTA; Lip learns getting laid is harder than anticipated when sober; and Kev and V take a trip to meet his birth family.",tt1586680,"A scrappy, feisty, fiercely loyal Chicago family makes no apologies."
Shameless,1,89,The (Mis)Education of Liam Fergus Beircheart Gallagher,"Dec 3, 2017",8.2,1000,"As Fiona tries to raise the profile of the neighborhood, Ian helps Trevor to raise money for a new youth shelter. Meanwhile, Carl gets creative with securing his tuition and Frank teaches Liam's school all about the working class.",tt1586680,"A scrappy, feisty, fiercely loyal Chicago family makes no apologies."
Shameless,1,90,Icarus Fell. And Rusty Ate Him.,"Dec 10, 2017",8.2,1000,"Fiona is forced to reflect on her own life after a lonely tenant dies. Meanwhile, Debbie has a pregnancy scare, Lip enlists Carl's help to search for his sponsor and Frank enjoys having his first-ever credit card.",tt1586680,"A scrappy, feisty, fiercely loyal Chicago family makes no apologies."
Shameless,1,91,Occupy Fiona,"Dec 17, 2017",8.1,1000,"Ian tests Fiona's resolve by bringing an ""Occupy Fiona"" protest to her front door. Lip struggles to get Youens to court for his trial. Meanwhile, Frank goes on a job hunt and Carl gets a new client with a plan to get him his tuition.",tt1586680,"A scrappy, feisty, fiercely loyal Chicago family makes no apologies."
Shameless,1,92,Frank's Northern Shuttle Express,"Dec 31, 2017",8.1,1000,"Frank starts a booming import-export business. Fiona considers moving into her own place. Meanwhile, Lip interviews new sponsors, Ian confronts an anti-gay pastor and Debbie deals with affording both school and raising Franny.",tt1586680,"A scrappy, feisty, fiercely loyal Chicago family makes no apologies."
Shameless,1,93,The Fugees,"Jan 7, 2018",7.9,987,"Frank's business takes a turn, sending him on the run. Ian's run-in with a minister brings unexpected allies. Meanwhile, Fiona tries to fit in with Ford's friends and Lip must decide whether to tell Sierra about Charlie's past.",tt1586680,"A scrappy, feisty, fiercely loyal Chicago family makes no apologies."
Shameless,1,94,Church of Gay Jesus,"Jan 14, 2018",7.8,1000,"Ian's sudden fame may be more than he can handle; Frank, however, finds a way to cash in. Meanwhile, Fiona struggles with her conscience over a worker who fell off her roof and Lip has a realization about his relationship with Youens.",tt1586680,"A scrappy, feisty, fiercely loyal Chicago family makes no apologies."
Shameless,1,95,A Gallagher Pedicure,"Jan 21, 2018",8.6,1100,"Fiona's homeless tenants barricade themselves in her apartment. Lip takes in a terrified Sierra and Lucas when her father is released from prison. Meanwhile, Ian provides sanctuary to a runaway teen and Frank considers his retirement.",tt1586680,"A scrappy, feisty, fiercely loyal Chicago family makes no apologies."
Shameless,1,96,Sleepwalking,"Jan 28, 2018",8.2,1100,"Fiona digs deep to get the homeless family out of her apartment. An explosive incident sends Ian into hiding. Meanwhile, Lip makes a difficult life decision as Frank schemes to take advantage of Liam's rich friend.",tt1586680,"A scrappy, feisty, fiercely loyal Chicago family makes no apologies."
Shameless,1,97,"Are You There Shim? It's Me, Ian.","Sep 9, 2018",8.1,1200,"Frank gets into trouble with the Hopkins Academy PTA. Fiona struggles with her decision to bail Ian out of jail, while he continues his Gay Jesus antics inside. Lip juggles taking care of Xan with a potential romance.",tt1586680,"A scrappy, feisty, fiercely loyal Chicago family makes no apologies."
Shameless,1,98,Mo White!,"Sep 16, 2018",7.4,1000,Fiona pursues a risky investment opportunity. Frank discovers the financial incentives of local politics. Carl bolsters his West Point application in unexpected ways. Ian is overwhelmed by the growth of the Gay Jesus movement.,tt1586680,"A scrappy, feisty, fiercely loyal Chicago family makes no apologies."
Shameless,1,99,Weirdo Gallagher Vortex,"Sep 23, 2018",7.5,976,Frank faces obstacles in his new role. Fiona prepares to close her real estate deal. Carl enlists V to help him get a recommendation from a congressman. Xan has a medical emergency. Ian embarks on a spiritual journey.,tt1586680,"A scrappy, feisty, fiercely loyal Chicago family makes no apologies."
Shameless,1,100,"Do Right, Vote White!","Sep 30, 2018",7.6,1000,"Election day puts Frank and Fiona in a head to head battle as they each try to round up votes for their candidates. Lip makes a choice about Xan's future. With his trial looming, Ian struggles to decide how to plead. 100th episode.",tt1586680,"A scrappy, feisty, fiercely loyal Chicago family makes no apologies."
Shameless,1,101,Black-Haired Ginger,"Oct 7, 2018",8.2,982,Frank's new liver medication comes with tragic side effects. Ian tries to get away from Fiona's hovering. Lip has to keep himself occupied during a day of temptation. Carl makes a connection at a West Point mixer.,tt1586680,"A scrappy, feisty, fiercely loyal Chicago family makes no apologies."
Shameless,1,102,"Face It, You're Gorgeous","Oct 14, 2018",9.0,1400,Frank employs Liam to help him chase down a romantic connection; Fiona struggles to keep up with the demands of her new investment as Ford pushes her to get serious about their relationship.,tt1586680,"A scrappy, feisty, fiercely loyal Chicago family makes no apologies."
Shameless,1,103,Down Like the Titanic,"Oct 21, 2018",8.4,999,Debbie finds Fiona at a low point and helps her pick up the pieces as Fiona continues to face pressure from Max Whitford on her investment hubris. Frank enjoys the honeymoon period of his relationship with Ingrid.,tt1586680,"A scrappy, feisty, fiercely loyal Chicago family makes no apologies."
Shameless,1,104,The Apple Doesn't Fall Far From the Alibi,"Jan 20, 2019",7.7,923,Fiona's downward spiral continues and Debbie steps in to pick up the slack at the Gallagher house. Ingrid ropes Frank into fulfilling her lifelong dream. Tami shows Lip a different version of adulthood.,tt1586680,"A scrappy, feisty, fiercely loyal Chicago family makes no apologies."
Shameless,1,105,BOOOOOOOOOOOONE!,"Jan 27, 2019",7.9,918,Frank searches for ways to finance Ingrid's vision for their future together. Fiona's anger issues cause problems at Patsy's. Lip is forced to confront his real feelings for Tami.,tt1586680,"A scrappy, feisty, fiercely loyal Chicago family makes no apologies."
Shameless,1,106,Los Diablos!,"Feb 10, 2019",7.9,877,Frank meets his match in a fellow participant in the Hobo Loco competition. Fiona has a dark encounter at Patsy's that scares her into cleaning up her act. Debbie throws herself into home improvements as she gets closer with Kelly.,tt1586680,"A scrappy, feisty, fiercely loyal Chicago family makes no apologies."
Shameless,1,107,The Hobo Games,"Feb 17, 2019",8.4,950,"The finals of the Hobo Games have arrived, and Frank faces off against his friend and greatest opponent. Lip prepares to officially adopt Xan, but his plans collide with Fiona's partying. Debbie develops feelings for someone surprising.",tt1586680,"A scrappy, feisty, fiercely loyal Chicago family makes no apologies."
Shameless,1,108,You'll Know the Bottom When You Hit It,"Feb 24, 2019",8.4,938,"When a blackout hits the South Side, Kevin and Veronica come up with a plan to bring the neighborhood together. Carl grows suspicious of Debbie's attempts to get closer with Kelly. Fiona receives guidance from an unexpected person.",tt1586680,"A scrappy, feisty, fiercely loyal Chicago family makes no apologies."
Shameless,1,109,Lost,"Mar 3, 2019",8.4,888,"Frank's injury gets in the way of everyone's plans as Fiona attempts to get her life back on track and Lip grows frustrated with his relationship with Tami. Carl gets some bad news about his future, and Debbie finally makes a move on Kelly.",tt1586680,"A scrappy, feisty, fiercely loyal Chicago family makes no apologies."
Shameless,1,110,Found,"Mar 10, 2019",9.1,1500,"As the Gallaghers decide what to do with a bedridden Frank, Fiona has to make a decision about her future. Carl and Debbie share their heartbreak together. Lip has to deal with a distressed Tami.",tt1586680,"A scrappy, feisty, fiercely loyal Chicago family makes no apologies."
Shameless,1,111,"We Few, We Lucky Few, We Band of Gallaghers!","Nov 10, 2019",7.5,991,"Frank milks his injury for all its worth as Debbie, now the self-elected leader of the Gallagher family, cooks up a scam of her own. Lip and Tami get a surprise. Carl returns home from military school and Liam faces an identity crisis.",tt1586680,"A scrappy, feisty, fiercely loyal Chicago family makes no apologies."
Shameless,1,112,Sleep Well My Prince for Tomorrow You Shall Be King,"Nov 17, 2019",7.4,869,"Feeling pressure from Debbie, Frank sets out to make money to keep his place in the house. Lip is overwhelmed by the demands of a newborn. Ian and Mickey struggle to keep the romance alive in prison.",tt1586680,"A scrappy, feisty, fiercely loyal Chicago family makes no apologies."
Shameless,1,113,Which America?,"Nov 24, 2019",7.4,849,Frank revels in his new position in the Gallagher house. Lip looks for support as the pressures of fatherhood take their toll. Ian and Mickey make a decision about their future.,tt1586680,"A scrappy, feisty, fiercely loyal Chicago family makes no apologies."
Shameless,1,114,A Little Gallagher Goes a Long Way,"Dec 1, 2019",7.1,839,Frank and Mikey set off on a day of adventure around the city in pursuit of Mikey's dreams. Debbie discovers a new way to make money in the midst of a strike as Lip leans on his new friend for parenting advice.,tt1586680,"A scrappy, feisty, fiercely loyal Chicago family makes no apologies."
Shameless,1,115,Sparky,"Dec 8, 2019",7.6,806,"Frank hatches the idea for a new scheme when an unexpected visitor shows up at the Gallagher house. With Tami back in the house, Lip struggles to give up control of Fred. Ian returns home and is thrown in with a corrupt parole officer.",tt1586680,"A scrappy, feisty, fiercely loyal Chicago family makes no apologies."
Shameless,1,116,Adios Gringos,"Dec 15, 2019",7.1,790,"Frank and Liam get wined and dined by potential baby buyers. Carl comes up with a strategy to protect Anne's family business, and Ian gets on Paula's bad side. Backed into a corner, Debbie fights to protect Franny from Pepa.",tt1586680,"A scrappy, feisty, fiercely loyal Chicago family makes no apologies."
Shameless,1,117,Citizen Carl,"Dec 22, 2019",7.6,770,"Carl embraces his civic duty. Debbie searches for her next payday. Frank meets the woman of his dreams. Ian and Mickey get roped into a dangerous scam. When tragedy strikes the Alibi, Kev and V go undercover to find new customers.",tt1586680,"A scrappy, feisty, fiercely loyal Chicago family makes no apologies."
Shameless,1,118,Debbie Might Be a Prostitute,"Dec 29, 2019",7.5,756,Debbie weighs the pros and cons of a new career. Frank uncovers the truth about Faye's living situation. A miscommunication between Ian and Mickey has disastrous consequences. Lip and Tami disagree over who should be taking care of Fred.,tt1586680,"A scrappy, feisty, fiercely loyal Chicago family makes no apologies."
Shameless,1,119,"O Captain, My Captain","Jan 5, 2020",6.9,808,"Frank goes back in time to uncover his connection to Faye, as Debbie's day with Claudia's daughter goes awry. Carl takes extreme measures to toughen up his new group of cadets. Ian struggles to connect with Mickey after their blowup.",tt1586680,"A scrappy, feisty, fiercely loyal Chicago family makes no apologies."
Shameless,1,120,Now Leaving Illinois,"Jan 12, 2020",7.6,743,An incident in the Tamietti family presents Lip and Tami with a new opportunity. Faye's betrayal lands Frank in front of a judge. Mickey's antics drive Ian to online dating. Carl makes an unexpected discovery at his new job.,tt1586680,"A scrappy, feisty, fiercely loyal Chicago family makes no apologies."
Shameless,1,121,"Location, Location, Location","Jan 19, 2020",7.8,726,"Frank finds a cushy place to make his new home. Lip gets cold feet when Tami moves forward with a plan for their future. Ian sees a new side of Mickey, and Debbie's love triangle reaches a breaking point.",tt1586680,"A scrappy, feisty, fiercely loyal Chicago family makes no apologies."
Shameless,1,122,"""Gallavich!""","Jan 26, 2020",9.1,1400,"Liam out-Gallaghers Frank, Lip works to convince Tami to stay in Chicago with their baby, Debbie turns over a new romantic leaf and Kev's new business takes off, but V wonders where the money is going. Season finale",tt1586680,"A scrappy, feisty, fiercely loyal Chicago family makes no apologies."
Shameless,1,123,This Is Chicago,"Dec 6, 2020",7.1,973,"Life during the pandemic: Frank fears gentrification, Kev and V get creative at the Alibi. Lip and Tami make their new house a home. Carl finishes the police academy. Debbie becomes her own boss. Ian and Mickey's honeymoon phase is over.",tt1586680,"A scrappy, feisty, fiercely loyal Chicago family makes no apologies."
Shameless,1,124,"Go Home, Gentrifier!","Dec 13, 2020",7.5,750,Debbie prepares a princess party for Franny. Mickey gets a real job. Frank helps Kev and V with their pot business. Lip runs into trouble with his new neighbors. Carl's first day on the force is not what he thought it would be.,tt1586680,"A scrappy, feisty, fiercely loyal Chicago family makes no apologies."
Shameless,1,125,Frances Francis Franny Frank,"Dec 20, 2020",7.9,782,"Debbie loses track of Franny while Frank and Franny have a day of adventure. Ian and Mickey question who is the ""man"" in their relationship. Carl gets a new Training Officer. Lip and Tami help Brad and Cami with their newborn baby.",tt1586680,"A scrappy, feisty, fiercely loyal Chicago family makes no apologies."
Shameless,1,126,NIMBY,"Jan 10, 2021",7.5,700,"Frank, Kev and Liam plot to get rid of the Milkoviches. Mickey starts a new security gig. V and Debbie turn into stage moms at a beauty pageant. Lip goes to brunch with Tami and her old teacher.",tt1586680,"A scrappy, feisty, fiercely loyal Chicago family makes no apologies."
Shameless,1,127,Slaughter,"Jan 31, 2021",7.3,676,Ian and Mickey's security gig comes into question. Frank and Kev try to take down the Milkovich's. V canvasses to get black people to the polls. Debbie takes Franny to meet her favorite wrestler. Carl and Leesie's policing comes to a head.,tt1586680,"A scrappy, feisty, fiercely loyal Chicago family makes no apologies."
Shameless,1,128,"Do Not Go Gentle Into That Good... Eh, Screw It","Feb 14, 2021",8.0,714,"Ian and Mickey help the Milkovich's. Frank's day takes some unexpected turns. Liam deals with inner turmoil. Debbie confronts Sandy. Carl enjoys his day off and Lip plans for the future. While Kev runs the bar, V is class parent at school.",tt1586680,"A scrappy, feisty, fiercely loyal Chicago family makes no apologies."
Shameless,1,129,"Two at a Biker Bar, One in the Lake","Mar 7, 2021",8.1,708,The Gallaghers disagree on the fate of their childhood home. Ian and Mickey seek out gay friends. Debbie and Sandy have a visitor from Sandy's past. Lip and Brad prepare to sell stolen bikes. Liam and V hope to pass the rent control bill.,tt1586680,"A scrappy, feisty, fiercely loyal Chicago family makes no apologies."
Shameless,1,130,Cancelled,"Mar 14, 2021",8.1,640,Frank and Liam compete in a renaming contest. Debbie has a day of no responsibilities. Ian and Mickey take on all the responsibility for Terry. Kevin tries to cheer up V. Carl is put on vice squad. Lip has a close encounter with the law.,tt1586680,"A scrappy, feisty, fiercely loyal Chicago family makes no apologies."
Shameless,1,131,Survivors,"Mar 21, 2021",7.5,585,Frank wants to pull one last heist. Lip and Brad find out who owns BornFree. Mickey and Ian uncover the truth about Terry. Liam looks for a new place to live. Kevin watches Gemma and Amy while running the Alibi.,tt1586680,"A scrappy, feisty, fiercely loyal Chicago family makes no apologies."
Shameless,1,132,DNR,"Mar 28, 2021",7.6,613,Liam and Frank embark on a journey to get Liam into STEM school. Carl's disillusionment with the police force comes to a head. Debbie hunts for a new place. Mickey and Ian consider the West Side. Kev meets Veronica in Louisville.,tt1586680,"A scrappy, feisty, fiercely loyal Chicago family makes no apologies."
Shameless,1,133,The Fickle Lady Is Calling It Quits,"Apr 4, 2021",8.7,902,"Kev and V announce the big news. Lip's progress in selling the house forces Debbie to reevaluate her past, present and future. Ian and Mickey adjust to a different neighborhood. Carl is reassigned. Liam reminds Frank what makes him Frank.",tt1586680,"A scrappy, feisty, fiercely loyal Chicago family makes no apologies."
Shameless,1,134,"Father Frank, Full of Grace","Apr 11, 2021",6.3,1800,"Ian and Mickey shop for furniture. Kev and V seek buyers for the Alibi. Lip settles for a new job, Carl finds his calling on the force. Debbie plunges into a dangerous world when she meets someone. Frank faces his mortality. Series finale.",tt1586680,"A scrappy, feisty, fiercely loyal Chicago family makes no apologies."
