tv,season,episode_number,title,airdate,rating,total_votes,episode_desc,episode_url,encoded_title,show_desc
This Is Us,5,6,Birth Mother,"Jan 12, 2021",8.9,1670,Randall uncovers new truths about his past.,https://www.imdb.com/title/tt13440628/,tt5555260,"A heartwarming and emotional story about a unique set of triplets, their struggles and their wonderful parents."
This Is Us,5,7,There,"Feb 9, 2021",8.5,1023,Kevin embarks on a stressful road trip; Jack and young Kevin go to a football training camp.,https://www.imdb.com/title/tt13761864/,tt5555260,"A heartwarming and emotional story about a unique set of triplets, their struggles and their wonderful parents."
This Is Us,5,8,In the Room,"Feb 16, 2021",9.0,1290,The Pearsons navigate huge family milestones together but from a distance.,https://www.imdb.com/title/tt13841384/,tt5555260,"A heartwarming and emotional story about a unique set of triplets, their struggles and their wonderful parents."
This Is Us,5,9,The Ride,"Feb 23, 2021",8.2,932,A series of car rides propels the Pearsons towards new stages of their lives.,https://www.imdb.com/title/tt14071708/,tt5555260,"A heartwarming and emotional story about a unique set of triplets, their struggles and their wonderful parents."
This Is Us,5,10,I've Got This,"Mar 16, 2021",8.1,868,Beth navigates qualms with her mother; Kevin and Kate bring their families together for dinner.,https://www.imdb.com/title/tt14122176/,tt5555260,"A heartwarming and emotional story about a unique set of triplets, their struggles and their wonderful parents."
This Is Us,5,11,One Small Step...,"Mar 23, 2021",8.7,1125,Kevin and Madison get an unexpected guest.,https://www.imdb.com/title/tt14209614/,tt5555260,"A heartwarming and emotional story about a unique set of triplets, their struggles and their wonderful parents."
This Is Us,5,12,Both Things Can Be True,"Apr 6, 2021",7.9,815,Jack and Miguel bond. Kevin and Madison navigate challenges. Randall seeks out a new kind of support network.,https://www.imdb.com/title/tt14301820/,tt5555260,"A heartwarming and emotional story about a unique set of triplets, their struggles and their wonderful parents."
This Is Us,5,13,Brotherly Love,"Apr 13, 2021",8.3,982,Kevin visits Randall in Philadelphia.,https://www.imdb.com/title/tt14357426/,tt5555260,"A heartwarming and emotional story about a unique set of triplets, their struggles and their wonderful parents."
This Is Us,5,14,The Music and the Mirror,"May 11, 2021",8.3,769,Beth navigates her career path. Kate and Toby face unexpected issues. A run-in with someone from his past gives Kevin pause.,https://www.imdb.com/title/tt14451164/,tt5555260,"A heartwarming and emotional story about a unique set of triplets, their struggles and their wonderful parents."
This Is Us,5,15,Jerry 2.0,"May 18, 2021",8.1,714,Kevin and Madison partake in their respective bachelor and bachelorette parties.,https://www.imdb.com/title/tt14583064/,tt5555260,"A heartwarming and emotional story about a unique set of triplets, their struggles and their wonderful parents."
This Is Us,5,16,The Adirondacks,"May 25, 2021",8.8,1042,The family gathers for Kevin and Madison's wedding.,https://www.imdb.com/title/tt14597122/,tt5555260,"A heartwarming and emotional story about a unique set of triplets, their struggles and their wonderful parents."
This Is Us,6,1,The Challenger,"Jan 4, 2022",8.3,705,The Big Three celebrate their 41st birthday.,https://www.imdb.com/title/tt10322344/,tt5555260,"A heartwarming and emotional story about a unique set of triplets, their struggles and their wonderful parents."
This Is Us,6,2,One Giant Leap,"Jan 11, 2022",8.3,653,"Nicky, Rebecca and Miguel go on a road trip.",https://www.imdb.com/title/tt16433208/,tt5555260,"A heartwarming and emotional story about a unique set of triplets, their struggles and their wonderful parents."
This Is Us,6,3,Four Fathers,"Jan 18, 2022",8.1,546,"Jack, Randall, Kevin and Toby struggle to connect with their children.",https://www.imdb.com/title/tt16433226/,tt5555260,"A heartwarming and emotional story about a unique set of triplets, their struggles and their wonderful parents."
This Is Us,6,4,Don't Let Me Keep You,"Jan 25, 2022",9.2,928,Jack visits Ohio.,https://www.imdb.com/title/tt16024734/,tt5555260,"A heartwarming and emotional story about a unique set of triplets, their struggles and their wonderful parents."
This Is Us,6,5,Heart and Soul,"Feb 1, 2022",8.5,518,Kevin visits the construction site; Malik and Déjà share controversial news at dinner.,https://www.imdb.com/title/tt16296824/,tt5555260,"A heartwarming and emotional story about a unique set of triplets, their struggles and their wonderful parents."
This Is Us,6,6,Our Little Island Girl: Part 2,"Feb 22, 2022",8.1,487,Beth prepares her dancers for the first big dance recital at her new job.,https://www.imdb.com/title/tt17372646/,tt5555260,"A heartwarming and emotional story about a unique set of triplets, their struggles and their wonderful parents."
This Is Us,6,7,Taboo,"Mar 8, 2022",8.7,505,Rebecca has a big announcement to make at Thanksgiving dinner.,https://www.imdb.com/title/tt17073768/,tt5555260,"A heartwarming and emotional story about a unique set of triplets, their struggles and their wonderful parents."
This Is Us,6,8,The Guitar Man,"Mar 15, 2022",7.9,427,Kevin takes the twins to the cabin in hopes of proving himself as a father.,https://www.imdb.com/title/tt18267002/,tt5555260,"A heartwarming and emotional story about a unique set of triplets, their struggles and their wonderful parents."
This Is Us,6,9,The Hill,"Mar 22, 2022",8.1,392,Kate visits Toby.,https://www.imdb.com/title/tt18547072/,tt5555260,"A heartwarming and emotional story about a unique set of triplets, their struggles and their wonderful parents."
This Is Us,6,10,Every Version of You,"Mar 29, 2022",8.8,364,Randall and Rebecca embark on a road trip and reflect on their past.,https://www.imdb.com/title/tt18815408/,tt5555260,"A heartwarming and emotional story about a unique set of triplets, their struggles and their wonderful parents."
This Is Us,6,11,Saturday in the Park,"Apr 5, 2022",9.0,299,Rebecca and Miguel's anniversary barbecue does not go as planned.,https://www.imdb.com/title/tt18967088/,tt5555260,"A heartwarming and emotional story about a unique set of triplets, their struggles and their wonderful parents."
