tv,season,episode_number,title,airdate,rating,total_votes,desc,encoded_title
Clarkson's Farm,1,1,Tractoring,"Jun 10, 2021",8.6,932,Jeremy Clarkson embarks on his path towards muddy misery and potential ruin by running his own farm.,tt10541088
Clarkson's Farm,1,2,Sheeping,"Jun 11, 2021",8.7,857,"Jeremy decides to get a flock of sheep, not realising the added complications these high-maintenance animals will bring.",tt10541088
Clarkson's Farm,1,3,Shopping,"Jun 11, 2021",8.8,769,Jeremy Clarkson decides to open a farm shop to sell his own produce. This sounds like it should be easy. It isn’t.,tt10541088
Clarkson's Farm,1,4,Wilding,"Jun 11, 2021",8.7,740,Jeremy Clarkson decides to become a naturalist.,tt10541088
Clarkson's Farm,1,5,Pan (dem) icking,"Jun 11, 2021",8.9,774,"As Covid-19 puts Britain on lockdown, Jeremy suddenly finds that his biggest worries aren’t all related to the upcoming lambing season.",tt10541088
Clarkson's Farm,1,6,Melting,"Jun 11, 2021",8.6,690,Jeremy discovers why British farmers are always complaining about the weather. It’s mostly because it never does what they want it to do.,tt10541088
Clarkson's Farm,1,7,Fluffing,"Jun 11, 2021",8.8,681,"As the drought drags on and harvest time gets closer, Jeremy and his motley crew have a fearsome list of jobs to complete.",tt10541088
Clarkson's Farm,1,8,Harvesting,"Jun 11, 2021",9.3,832,After months of hard work Clarkson's farm arrives at a make or break moment; harvest time.,tt10541088
Clarkson's Farm,1,9,Episode #2.1,S2,0.0,0,,tt10541088
