tv,season,episode_number,title,airdate,rating,total_votes,episode_desc,encoded_title,show_desc
Hunter x Hunter,1,57,Initiative × and × Law,"Jul 9, 2017",8.9,808,"Gon and Killua are captives of the spiders. Kurapika, Melody, and Leorio hatch a plan to capture Chrollo and use him as leverage to force the remaining Spiders to release Gon and Killua.",tt2098220,"Gon Freecss aspires to become a Hunter, an exceptional being capable of greatness. With his friends and his potential, he seeks for his father who left him when he was younger."
Hunter x Hunter,1,58,Signal × to × Retreat,"Jul 16, 2017",9.2,1000,Kurapika negotiates with Pakunoda to secure the exchange of Gon and Killua. Pakunoda returns to the Troupe's hideout to announce the terms of the exchange to the remaining members.,tt2098220,"Gon Freecss aspires to become a Hunter, an exceptional being capable of greatness. With his friends and his potential, he seeks for his father who left him when he was younger."
Hunter x Hunter,1,59,Bid × and × Haste,"Jul 23, 2017",7.8,624,Gon and Killua attend an auction of Greed Island to scout out potential employers hiring Hunters to clear the game.,tt2098220,"Gon Freecss aspires to become a Hunter, an exceptional being capable of greatness. With his friends and his potential, he seeks for his father who left him when he was younger."
Hunter x Hunter,1,60,End × and × Beginning,"Jul 30, 2017",7.8,618,Gon and Killua attend the player selection test in a bid to gain access to Greed Island.,tt2098220,"Gon Freecss aspires to become a Hunter, an exceptional being capable of greatness. With his friends and his potential, he seeks for his father who left him when he was younger."
Hunter x Hunter,1,61,Invitation × and × Friend,"Aug 6, 2017",7.7,621,"Gon and Killua enter Greed Island. There they enter a town and meet other players, where they learn more about the game Greed Island.",tt2098220,"Gon Freecss aspires to become a Hunter, an exceptional being capable of greatness. With his friends and his potential, he seeks for his father who left him when he was younger."
Hunter x Hunter,1,62,Reality? × and × Raw,"Aug 13, 2017",7.6,606,Gon and Killua battling at the Rock Paper Scissors tournament. Killua wins and he gets the #83 Card then comes some guy trying to steal the card but he fails. And then come a bunch of guys trying to steal and they do. Now Gon And Killua want to go to Masadora. They see Biscuit stalking them and they find some Monsters and Bandits on their way as well.,tt2098220,"Gon Freecss aspires to become a Hunter, an exceptional being capable of greatness. With his friends and his potential, he seeks for his father who left him when he was younger."
Hunter x Hunter,1,63,A × Hard × Master?,"Aug 20, 2017",8.1,619,"Binolt all attacks Biscuit, she easily defeats him. Gon and Killua seeing her strength asked her to be their master and proceed to fight Binolt for 6 days. He gives up and they let him go. They go to the city of Masadora and got some cards but told them to go back to the rocky area again. Biscuit tells them that they are going exactly straight to Masadora but this tim... Read all",tt2098220,"Gon Freecss aspires to become a Hunter, an exceptional being capable of greatness. With his friends and his potential, he seeks for his father who left him when he was younger."
Hunter x Hunter,1,64,Strengthen × and × Threaten,"Aug 27, 2017",7.7,610,"After learning how to use Shu, they made it to Masadora easily, only to be told to head back to the rocky area again to obtain the remaining monster cards there. They each catch a few and then they move on to the hardest monster in the area, the bubble horse. They got the card by dodging the blue bubbles with zetsu, and the red bubbles with ten. Biscuit comments that ... Read all",tt2098220,"Gon Freecss aspires to become a Hunter, an exceptional being capable of greatness. With his friends and his potential, he seeks for his father who left him when he was younger."
Hunter x Hunter,1,65,Evil Fist × and × Rock-Paper-Scissors,"Sep 10, 2017",7.7,597,"After hearing Biscuit's lecture on rock-paper-scissors, Gon decides to work on a special technique modeled off of rock-paper-scissors by using Enhancer, Emitter, and Conjurer abilities. Meanwhile, Killua leaves the game temporarily to take the Hunter Exam. While he's gone, Gon and Biscuit find learn about the Bomber's most recent attack.",tt2098220,"Gon Freecss aspires to become a Hunter, an exceptional being capable of greatness. With his friends and his potential, he seeks for his father who left him when he was younger."
Hunter x Hunter,1,66,Strategy × and × Scheme,"Sep 17, 2017",7.7,600,"Killua returns after easily passing his second try at the Hunter Exam. Now that Gon, Killua, and Biscuit are together again, they begin working on beating this game by collecting cards. Meanwhile, the other players are scheming to gather the cards they need to complete the game.",tt2098220,"Gon Freecss aspires to become a Hunter, an exceptional being capable of greatness. With his friends and his potential, he seeks for his father who left him when he was younger."
Hunter x Hunter,1,67,15 × 15,"Sep 24, 2017",7.5,604,"Team Genthru now has 96 different types of restricted slot cards after tricking Team Tsegzerra. Gon and Killua receive an invitation from other players to team up to prevent Genthru from beating the game. They head to Soufrabi to monopolize Patch of Shore, one of the cards Genthru is missing.",tt2098220,"Gon Freecss aspires to become a Hunter, an exceptional being capable of greatness. With his friends and his potential, he seeks for his father who left him when he was younger."
Hunter x Hunter,1,68,Pirates × and × Guesses,"Oct 1, 2017",8.2,633,"When they reach Soufrabi, they met the pirates and they challenge the team in a sports battle. While the team loses, Killua gather information and the other team disbanded. So they use the card accompany on and meet up with Chrollo Lucifer which appears to be Hisoka, and Hisoka leads them to the city of love, Aiai.",tt2098220,"Gon Freecss aspires to become a Hunter, an exceptional being capable of greatness. With his friends and his potential, he seeks for his father who left him when he was younger."
Hunter x Hunter,1,69,A × Heated × Showdown,"Oct 8, 2017",8.7,693,"Gon and his friends have teamed up with Hisoka and Goreinu to challenge Razor again. To round out the party, they recruit Team Tsezgerra. Their preparations allow them to breeze through the first few matches, but then Razor challenges them to a game of dodgeball.",tt2098220,"Gon Freecss aspires to become a Hunter, an exceptional being capable of greatness. With his friends and his potential, he seeks for his father who left him when he was younger."
Hunter x Hunter,1,70,Guts × and × Courage,"Oct 15, 2017",9.2,1000,"Gon is unable to hold onto Razor's throw and is sent to the outfield. He uses Back to return, but Hisoka is also injured and the situation looks grim. However, Gon has an idea for defeating Razor, but he needs Killua's help to pull it off.",tt2098220,"Gon Freecss aspires to become a Hunter, an exceptional being capable of greatness. With his friends and his potential, he seeks for his father who left him when he was younger."
Hunter x Hunter,1,71,Bargain × and × Deal,"Oct 22, 2017",9.1,883,"Gon, Killua, and Hisoka manage to defeat Razor by working as a perfect team. After defeating Razor, Gon learns a little more about his father from Razor. The team gets Patch of Shore, and make two clones. Gon's team receives the real card, which Genthru does not expect. Team Tsezgerra will delay Genthru for three weeks, giving Killua time to heal and Gon time to train... Read all",tt2098220,"Gon Freecss aspires to become a Hunter, an exceptional being capable of greatness. With his friends and his potential, he seeks for his father who left him when he was younger."
Hunter x Hunter,1,72,Chase × and × Chance,"Nov 5, 2017",7.6,595,"Hisoka meets up with the members of the Phantom Troupe in order to track down the Nen user whose ability is to remove others nen. Meanwhile, Team Tsezgerra gathered enough Accompany cards to evade Team Genthru, declaring their decision to fight instead of surrender. Team Genthru had also collected Accompany cards and began ""a game of tag they cannot lose"". Gon continu... Read all",tt2098220,"Gon Freecss aspires to become a Hunter, an exceptional being capable of greatness. With his friends and his potential, he seeks for his father who left him when he was younger."
Hunter x Hunter,1,73,Insanity × and × Sanity,"Nov 12, 2017",8.4,649,"After Team Tsezgerra left the game, Mr. Battera reveals the true purpose behind why he purchased so many Greed Island games. Team Genthru have set camp up at the entrance awaiting Tsezgerra's return to be disappointed when they don't. Assuming that Tsezgerra and his team have given up on the game, Genthru approach Team Gon to propose a deal for the two remaining cards... Read all",tt2098220,"Gon Freecss aspires to become a Hunter, an exceptional being capable of greatness. With his friends and his potential, he seeks for his father who left him when he was younger."
Hunter x Hunter,1,74,Victor × and × Loser,"Nov 19, 2017",9.0,786,"With two of the members of Team Genthru down, Gon is left in a standoff with just Genthru himself. Everything Gon and his team had planned were coming together. Selfishly though, Gon decides to temporarily ignore the plan because he wanted to try something out, getting badly damaged in the process. Gon finally pulls through as Team Genthru is defeated. With the most d... Read all",tt2098220,"Gon Freecss aspires to become a Hunter, an exceptional being capable of greatness. With his friends and his potential, he seeks for his father who left him when he was younger."
Hunter x Hunter,1,75,Ging's Friends × and × True Friends,"Dec 3, 2017",8.5,636,"Gon, Killua and Biscuit are challenged when they finally get all 99 reserved card slots. An in-game event takes place to win the #00 card. Who will win?",tt2098220,"Gon Freecss aspires to become a Hunter, an exceptional being capable of greatness. With his friends and his potential, he seeks for his father who left him when he was younger."
Hunter x Hunter,1,76,Reunion × and × Understanding,"Dec 10, 2017",7.5,644,"Recently beating the game his father and friends created, Greed Island, Gon and Killua use the cards they brought back with them to teleport to whom they believe is Gon's father.",tt2098220,"Gon Freecss aspires to become a Hunter, an exceptional being capable of greatness. With his friends and his potential, he seeks for his father who left him when he was younger."
Hunter x Hunter,1,77,Unease × and × Sighting,"Dec 17, 2017",7.5,627,"Kite is shown a huge severed member which it is believed to be from a Chimera Ant Queen that has grown to the height of two meters. As Gon and Killua join him in his search for the Queen, their fears are confirmed when it starts consuming humans to enhance its army of soldiers.",tt2098220,"Gon Freecss aspires to become a Hunter, an exceptional being capable of greatness. With his friends and his potential, he seeks for his father who left him when he was younger."
Hunter x Hunter,1,78,Very × Rapid × Reproduction,"Jan 7, 2018",7.3,631,"Kite and his party trace the whereabouts of the Chimera Queen and conclude that it is located in the neo-ludite nation of NGL. As both Kite's group and another separate team of hunters depart to NGL to investigate, the Queen establishes her stronghold and instructs her soldiers to gather a huge number of humans for her to consume in order to give birth to the King.",tt2098220,"Gon Freecss aspires to become a Hunter, an exceptional being capable of greatness. With his friends and his potential, he seeks for his father who left him when he was younger."
Hunter x Hunter,1,79,No × Good × NGL,"Jan 14, 2018",7.5,602,"Upholding their policy of not allowing any kind of manufactured or artificial material inside their borders, the NGL only allows Kite, Gon, Killua and two other members of their party to enter their country, with the rest forced to stand by and await their return. Meanwhile, the second team of Hunters is attacked by the Chimera Ants, whose human DNA triggers in them a... Read all",tt2098220,"Gon Freecss aspires to become a Hunter, an exceptional being capable of greatness. With his friends and his potential, he seeks for his father who left him when he was younger."
Hunter x Hunter,1,80,Evil × and × Terrible,"Jan 21, 2018",8.3,667,"As the top echelons of the NGL are killed by the Chimera Ants who claim their weapons and facilities, the team of Hunters under attack is also taken down, but not before one of them sends a message to warn the Hunter Association that ends up on Kite's hands. As he instructs the others to turn back and call for reinforcements, Kite decides to check up the situation fur... Read all",tt2098220,"Gon Freecss aspires to become a Hunter, an exceptional being capable of greatness. With his friends and his potential, he seeks for his father who left him when he was younger."
Hunter x Hunter,1,81,The × Fight × Begins,"Jan 28, 2018",7.8,609,"Confirming his suspicions, Kite finds clues about the dark side of the NGL and meet Rammot, one of the Chimera Ants. Knowing that much stronger foes await them ahead, Kite declares that Gon and Killua must defeat the enemy by themselves, or they will not be allowed to proceed further with him. Meanwhile, the Chimera Ant commanders take heed of Nen-enhanced humans and ... Read all",tt2098220,"Gon Freecss aspires to become a Hunter, an exceptional being capable of greatness. With his friends and his potential, he seeks for his father who left him when he was younger."
Hunter x Hunter,1,82,Kite × and × Slots,"Feb 4, 2018",8.5,652,"Searching for the Chimera Ant's nest, Kite and the boys confirm their suspicions about the NGL and must face three dangerous enemies in order to proceed. Meanwhile, Rammot wants to payback Gon and Killua for his defeat and ends up unwittingly unlocking the power of Nen in his body.",tt2098220,"Gon Freecss aspires to become a Hunter, an exceptional being capable of greatness. With his friends and his potential, he seeks for his father who left him when he was younger."
Hunter x Hunter,1,83,Inspiration × to × Evolve,"Feb 11, 2018",8.4,639,"News about the Chimera Ants threat reach the Hunter Association and an expedition is assembled to exterminate them. Meanwhile, Kite, Gon and Killua are surrounded by a large number of enemies and must fight for their lives. Back at the nest, the other squadron leaders look for a way to awaken the Nen in their bodies just like Rammot did.",tt2098220,"Gon Freecss aspires to become a Hunter, an exceptional being capable of greatness. With his friends and his potential, he seeks for his father who left him when he was younger."
Hunter x Hunter,1,84,A × Fated × Awakening,"Feb 18, 2018",8.4,657,"As Gon, Killua and Kite approach the nest, one of the Chimera Ant Royal Guards, Neferpitou, awakens. Upon extracting information from a surviving Hunter, Neferpitou learns the secrets of Nen, including the means to awaken and control it.",tt2098220,"Gon Freecss aspires to become a Hunter, an exceptional being capable of greatness. With his friends and his potential, he seeks for his father who left him when he was younger."
Hunter x Hunter,1,85,Light X and X Darkness,"Feb 25, 2018",9.4,1300,"As the Chimera Ants are reunited to unlock the power of Nen into their bodies, Neferpitou feels the presence of Kite approaching and leaves to confront him. Realizing that the enemy is too powerful for them, Kite warns Gon and Killua to flee, but Gon is taken by rage upon seeing Kite's arm being severed by Neferpitou and Killua is forced to knock him down and escape c... Read all",tt2098220,"Gon Freecss aspires to become a Hunter, an exceptional being capable of greatness. With his friends and his potential, he seeks for his father who left him when he was younger."
Hunter x Hunter,1,86,Promise X and X Reunion,"Mar 4, 2018",8.0,592,"Gon and Killua meet Knov's student Palm and learn that to earn a place in the Extermination Squad and return to the NGL, they must win against Morel's students Knuckle and Shoot in one month. To increase their chances of winning, Palm asks for Biscuit's help and they start a harsh training routine with her. Meanwhile at the Chimera Ants nest, Shaiapouf, the second Roy... Read all",tt2098220,"Gon Freecss aspires to become a Hunter, an exceptional being capable of greatness. With his friends and his potential, he seeks for his father who left him when he was younger."
Hunter x Hunter,1,87,Duel × and × Escape,"Mar 11, 2018",7.7,579,"After completing their training, Biscuit sends the exhausted Gon and Killua to face Knuckle. Looking at the condition of their opponents, Knuckle boasts that they could never move him an inch and bets his token on it. However His assumptions are proven wrong when Gon manages to land a powerful hit that knocks him out cold, and after awakening, Knuckle agrees that he w... Read all",tt2098220,"Gon Freecss aspires to become a Hunter, an exceptional being capable of greatness. With his friends and his potential, he seeks for his father who left him when he was younger."
Hunter x Hunter,1,88,Rock-Paper-Scissors × and × Weakness,"Mar 18, 2018",7.8,592,"As the deadline established by Netero approaches, the Chairman and his companions keep wiping out the Chimera Ant squads one by one and the remaining squad captains try to deal with the problem, while the third member of the royal guard, Menthuthuyoupi is born. Meanwhile, Gon and Killua complete their training and challenge Knuckle for a decisive battle.",tt2098220,"Gon Freecss aspires to become a Hunter, an exceptional being capable of greatness. With his friends and his potential, he seeks for his father who left him when he was younger."
Hunter x Hunter,1,89,Compassion X and X Strength,"Mar 25, 2018",8.1,571,"Knuckle points out that Gon's Jajanken technique has two major weaknesses, but he keeps using it instead, making use of these flaws to confuse his opponent. However, just as Gon has a chance to deal a finishing blow, he collapses from exhaustion. Killua than carries Gon away, promising to return in the next day for the decisive battle against Knuckle and Shoot. As Gon... Read all",tt2098220,"Gon Freecss aspires to become a Hunter, an exceptional being capable of greatness. With his friends and his potential, he seeks for his father who left him when he was younger."
Hunter x Hunter,1,90,Interest X and X Curse,"Apr 8, 2018",7.8,602,"The final duel between Gon and Knuckle begins. Just as he promised, Knuckle does not hold back and uses his special technique on him, forcing Gon to look for a way to defeat him as fast as possible. Meanwhile, Killua confronts Shoot, but he also gets himself in a pinch when his old habit to avoid stronger enemies is triggered.",tt2098220,"Gon Freecss aspires to become a Hunter, an exceptional being capable of greatness. With his friends and his potential, he seeks for his father who left him when he was younger."
Hunter x Hunter,1,91,The Strong X and X the Weak,"Apr 15, 2018",8.9,758,"The chimera ant king is born earlier than expected, leaving the queen in a critical condition. As the king abandons the nest accompanied by the royal guard, the squadron leaders disband except for a few loyal ones who surrender to Netero's party in exchange for help to save the queen's life. Meanwhile, Shoot and Knuckle, having defeated Gon and Killua, arrive at the N... Read all",tt2098220,"Gon Freecss aspires to become a Hunter, an exceptional being capable of greatness. With his friends and his potential, he seeks for his father who left him when he was younger."
Hunter x Hunter,1,92,One Wish X and X Two Promises,"Apr 22, 2018",7.9,620,"Despite all efforts to save the queen, she does not resist her wounds and dies, but not before revealing to Colt the name she had chosen for the king, ""Meruem"". A final live offspring is found inside her body and Morel offers himself to protect both after he promises that they will never eat humans anymore. As the other squad leaders leave to build their own colonies,... Read all",tt2098220,"Gon Freecss aspires to become a Hunter, an exceptional being capable of greatness. With his friends and his potential, he seeks for his father who left him when he was younger."
Hunter x Hunter,1,93,Date X with X Palm,"Apr 29, 2018",7.7,604,"Gon and Killua return to meet Palm, prepared to face her fury upon failing to fulfill their promise, but she decides to forgive them when Gon accepts her request to have a date with her.",tt2098220,"Gon Freecss aspires to become a Hunter, an exceptional being capable of greatness. With his friends and his potential, he seeks for his father who left him when he was younger."
Hunter x Hunter,1,94,Friend X and X Journey,"May 6, 2018",8.5,711,"To protect a helpless Gon, Killua must face off against a powerful chimera ant on his own however Illumi's passive manipulation complicates the fight.",tt2098220,"Gon Freecss aspires to become a Hunter, an exceptional being capable of greatness. With his friends and his potential, he seeks for his father who left him when he was younger."
Hunter x Hunter,1,95,Grudge × and × Dread,"May 13, 2018",8.6,658,"Knuckle and Morel appear to be overwhelmed by the speed of Cheetu's attacks, but they have a chance at victory. Knuckle smiles and says they have intelligence and experience on their side, as Morel exhales white smoke that surrounds all three of them.",tt2098220,"Gon Freecss aspires to become a Hunter, an exceptional being capable of greatness. With his friends and his potential, he seeks for his father who left him when he was younger."
Hunter x Hunter,1,96,A × Lawless × Home,"May 20, 2018",8.6,685,The Phantom Troupe return to Meteor City only to discover a Zazan has taken over. They infiltrate her palace and face off against her underlings.,tt2098220,"Gon Freecss aspires to become a Hunter, an exceptional being capable of greatness. With his friends and his potential, he seeks for his father who left him when he was younger."
Hunter x Hunter,1,97,Carnage × and × Devastation,"Jun 3, 2018",9.0,882,"The Phantom Troupe prove to be far more dangerous than the chimera ants had expected. Zazan and Feitan fight to the death. Killua's younger sister, Kalluto, learns how far she still has to go if she wants to be powerful.",tt2098220,"Gon Freecss aspires to become a Hunter, an exceptional being capable of greatness. With his friends and his potential, he seeks for his father who left him when he was younger."
Hunter x Hunter,1,98,Infiltration × and × Selection,"Jun 10, 2018",7.5,581,Gon and Killua arrive in a village in East Gorteau but find no trace of the inhabitants. They find and follow bloodstains out of a house only to discover corpses dug up by wild dogs. Killua reveals to Gon that he's realized the true purpose of the national celebration...,tt2098220,"Gon Freecss aspires to become a Hunter, an exceptional being capable of greatness. With his friends and his potential, he seeks for his father who left him when he was younger."
Hunter x Hunter,1,99,Combination × and × Evolution,"Jun 17, 2018",7.7,574,Gon is followed by a mysterious foe who unleashes two chimera ants on him - an owl and a bat. They work together and things look bleak for Gon.,tt2098220,"Gon Freecss aspires to become a Hunter, an exceptional being capable of greatness. With his friends and his potential, he seeks for his father who left him when he was younger."
Hunter x Hunter,1,100,Tracking × and × Pursuit,"Jun 24, 2018",8.1,582,"Knuckle and Shoot attempt to ambush Cheetu, but at the last minute, he changes directions and flees.",tt2098220,"Gon Freecss aspires to become a Hunter, an exceptional being capable of greatness. With his friends and his potential, he seeks for his father who left him when he was younger."
Hunter x Hunter,1,101,Ikalgo × and × Lightning,"Jul 1, 2018",8.6,674,"Killua is trapped in a nen darts game. The darts materialize only when they pierce his body, so he must come up with a solution to catch them before he bleeds out.",tt2098220,"Gon Freecss aspires to become a Hunter, an exceptional being capable of greatness. With his friends and his potential, he seeks for his father who left him when he was younger."
Hunter x Hunter,1,102,Power × and × Games,"Jul 8, 2018",7.9,586,Gon decides to accept Meleoron's offer to become partners. Meleoron reveals his true powers and his plan to defeat the chimera King.,tt2098220,"Gon Freecss aspires to become a Hunter, an exceptional being capable of greatness. With his friends and his potential, he seeks for his father who left him when he was younger."
Hunter x Hunter,1,103,Check × and × Mate,"Jul 15, 2018",8.1,566,"The King is killing time as he awaits the selection. He calls upon masters of shogi and go and defeats every one of them. The next person he calls is a blind girl by the name of Komugi, who is the world champion of Gungi, the national game of East Gorteau.",tt2098220,"Gon Freecss aspires to become a Hunter, an exceptional being capable of greatness. With his friends and his potential, he seeks for his father who left him when he was younger."
