tv,season,episode_number,title,airdate,rating,total_votes,episode_desc,encoded_title,show_desc
Hunter x Hunter,1,1,Departure × and × Friends,"Apr 17, 2016",7.6,1200,"Twelve-year-old Gon Freecss catches Whale Island's monster fish, the ""Master of the Swamp"" to gain permission from his Aunt Mito Freecss to take the Hunter Exam. Aboard the ship going to the location of the examination, Gon impresses the Captain when he predicts a violent storm approaching and meets Leorio and Kurapika.",tt2098220,"Gon Freecss aspires to become a Hunter, an exceptional being capable of greatness. With his friends and his potential, he seeks for his father who left him when he was younger."
Hunter x Hunter,1,2,Test × of × Tests,"Apr 24, 2016",7.8,956,"Gon, Kurapika and Leorio reach Dolle Harbor and told by the captain to head for the cedar tree on the hilltop behind the city. The three are stopped by a group of masked people and an old woman posts a riddle requiring them to choose between 2 possible answers.",tt2098220,"Gon Freecss aspires to become a Hunter, an exceptional being capable of greatness. With his friends and his potential, he seeks for his father who left him when he was younger."
Hunter x Hunter,1,3,Rivals × for × Survival,"May 1, 2016",7.7,882,"Gon, Kurapika, and Leorio arrive at Zaban City, the venue of the Hunter Exam, where they meet Tonpa another friendly veteran examiners.",tt2098220,"Gon Freecss aspires to become a Hunter, an exceptional being capable of greatness. With his friends and his potential, he seeks for his father who left him when he was younger."
Hunter x Hunter,1,4,Hope × and × Ambition,"May 8, 2016",8.0,861,"Gon befriends Killua. Leorio nearly gives up, but Gon waits for him until Leorio gains the motivation to catch up. Later, the group shares their own reasons of becoming Hunters.",tt2098220,"Gon Freecss aspires to become a Hunter, an exceptional being capable of greatness. With his friends and his potential, he seeks for his father who left him when he was younger."
Hunter x Hunter,1,5,Hisoka × is × Sneaky,"May 15, 2016",8.2,847,"The marathon through the wetlands starts, with Leorio and Kurapika getting separated from Gon and Killua. In the fog, many applicants try to take down Hisoka.",tt2098220,"Gon Freecss aspires to become a Hunter, an exceptional being capable of greatness. With his friends and his potential, he seeks for his father who left him when he was younger."
Hunter x Hunter,1,6,A × Surprising × Challenge,"May 22, 2016",7.5,830,"Gourmet Hunters Menchi and Buhara task the applicants to cook a pork dish with meat from the worlds most dangerous pig for the second phase, to the annoyance of applicants.",tt2098220,"Gon Freecss aspires to become a Hunter, an exceptional being capable of greatness. With his friends and his potential, he seeks for his father who left him when he was younger."
Hunter x Hunter,1,7,Showdown × on × the Airship,"Jun 5, 2016",8.3,863,"Chairman Netero sees and challenges them to a game that involves getting a ball from him, telling them that they will automatically become Hunters if they succeed.",tt2098220,"Gon Freecss aspires to become a Hunter, an exceptional being capable of greatness. With his friends and his potential, he seeks for his father who left him when he was younger."
Hunter x Hunter,1,8,Solution × Is × Majority Rules?,"Jun 12, 2016",7.8,795,"For the third phase, the candidates are abandoned at the top of Trick Tower, wherein long-term criminals are kept. They are given 72 hours to get out alive and pass the exam.",tt2098220,"Gon Freecss aspires to become a Hunter, an exceptional being capable of greatness. With his friends and his potential, he seeks for his father who left him when he was younger."
Hunter x Hunter,1,9,Beware × of × Prisoners,"Jun 19, 2016",8.3,828,Gon faces off against Sedokan and Majitani faces off against Kurapika who reveals a startling and scary secret.,tt2098220,"Gon Freecss aspires to become a Hunter, an exceptional being capable of greatness. With his friends and his potential, he seeks for his father who left him when he was younger."
Hunter x Hunter,1,10,Trick × to the × Trick,"Jun 26, 2016",7.9,811,"Leorio has to postpone the start of his match until Kurapika officially ends his. However, his opponent is unconscious and cannot surrender. Leorio eventually begins his match, in which the game is gambling.",tt2098220,"Gon Freecss aspires to become a Hunter, an exceptional being capable of greatness. With his friends and his potential, he seeks for his father who left him when he was younger."
Hunter x Hunter,1,11,Trouble × with the × Gamble,"Jul 10, 2016",8.6,927,Leorio's match continues and he struggles to think of bets he is certain to win. Killua faces a serial killer in a fight to the death.,tt2098220,"Gon Freecss aspires to become a Hunter, an exceptional being capable of greatness. With his friends and his potential, he seeks for his father who left him when he was younger."
Hunter x Hunter,1,12,Last x Test of x Resolve!,"Jul 17, 2016",7.9,797,"The group must spend the 50 hours Leorio gambled away in a confined room. Once they are out, they must decide by majority on which path to take: one takes 45 hours and allows all 5 to pass, the other takes is faster but only 3 can pass.",tt2098220,"Gon Freecss aspires to become a Hunter, an exceptional being capable of greatness. With his friends and his potential, he seeks for his father who left him when he was younger."
Hunter x Hunter,1,13,Letter × From × Gon,"Jul 24, 2016",4.4,783,Mito reads a letter from Gon recapping his adventure so far.,tt2098220,"Gon Freecss aspires to become a Hunter, an exceptional being capable of greatness. With his friends and his potential, he seeks for his father who left him when he was younger."
Hunter x Hunter,1,14,Hit × the × Target,"Jul 31, 2016",7.6,770,"After exiting Trick Tower, the contestants are taken to Zevil Island to begin stage 4. Each contestant picks a number out of a box and must hunt the contestant with that number on the island.",tt2098220,"Gon Freecss aspires to become a Hunter, an exceptional being capable of greatness. With his friends and his potential, he seeks for his father who left him when he was younger."
Hunter x Hunter,1,15,Explosion × of × Deception,"Aug 7, 2016",8.0,777,"Gon is relying on Bloodcrazy Butterflies to find his target, Hisoka, before waiting for the perfect time to use his skill with the fishing rod to snatch Hisoka's tag. Meanwhile, Leorio is tricked by Tonpa and loses his own tag, but Kurapika helps him recover it.",tt2098220,"Gon Freecss aspires to become a Hunter, an exceptional being capable of greatness. With his friends and his potential, he seeks for his father who left him when he was younger."
Hunter x Hunter,1,16,Defeat × and × Disgrace,"Aug 14, 2016",8.8,896,"Kurapika and Leorio are being stalked by Hisoka, but they managed to negotiate their way out of a fight. However, the encounter leaves Hisoka aroused, so he leaves in search of a new target. Gon is able to use his fishing rod to snatch Hisoka's tag right when Hisoka attacks his target. However, as Gon tries to escape, he is attacked by another applicant and loses his ... Read all",tt2098220,"Gon Freecss aspires to become a Hunter, an exceptional being capable of greatness. With his friends and his potential, he seeks for his father who left him when he was younger."
Hunter x Hunter,1,17,Trap × in × the Hole,"Aug 21, 2016",7.9,775,Killua grows tired of having Imori shadowing him so he challenges Imori to a fight.,tt2098220,"Gon Freecss aspires to become a Hunter, an exceptional being capable of greatness. With his friends and his potential, he seeks for his father who left him when he was younger."
Hunter x Hunter,1,18,Big × Time × Interview,"Aug 28, 2016",8.0,767,Gon and his friends have been trapped inside a cave by poisonous snakes.,tt2098220,"Gon Freecss aspires to become a Hunter, an exceptional being capable of greatness. With his friends and his potential, he seeks for his father who left him when he was younger."
Hunter x Hunter,1,19,Can't Win × But × Can't Lose,"Sep 11, 2016",8.9,947,Gon and his friends have advanced to the final phase of the Hunter Exam.,tt2098220,"Gon Freecss aspires to become a Hunter, an exceptional being capable of greatness. With his friends and his potential, he seeks for his father who left him when he was younger."
Hunter x Hunter,1,20,Baffling Turn × of × Events,"Sep 18, 2016",9.0,1000,"Gon wakes up, and finds himself being congratulated by Satotz for being the first person to pass the Hunter Exam.",tt2098220,"Gon Freecss aspires to become a Hunter, an exceptional being capable of greatness. With his friends and his potential, he seeks for his father who left him when he was younger."
Hunter x Hunter,1,21,Some × Brother × Trouble,"Sep 25, 2016",7.8,757,"After winning the exam everyone is on their path. Gon,kurapika and leorio team up to help killua.",tt2098220,"Gon Freecss aspires to become a Hunter, an exceptional being capable of greatness. With his friends and his potential, he seeks for his father who left him when he was younger."
Hunter x Hunter,1,22,A × Dangerous × Watchdog,"Oct 2, 2016",7.6,748,"After arriving in the Republic of Podokea, Gon, Leorio, and Kurapika board a tour bus to Kukuroo Mountain, where Killua lives.",tt2098220,"Gon Freecss aspires to become a Hunter, an exceptional being capable of greatness. With his friends and his potential, he seeks for his father who left him when he was younger."
Hunter x Hunter,1,23,The × Guard's × Duty,"Oct 9, 2016",8.0,768,"Gon and his friends have decided to pass through the Testing Gate to see Killua. Zebro takes them to the servants' quarters where they meet Seaquant and rest for the night. They discover that every thing in the house is extremely heavy, so they decide to train so they can be strong enough to open the Testing Gate on their own. Meanwhile, Killua is being tortured by hi... Read all",tt2098220,"Gon Freecss aspires to become a Hunter, an exceptional being capable of greatness. With his friends and his potential, he seeks for his father who left him when he was younger."
Hunter x Hunter,1,24,The × Zoldyck × Family,"Oct 16, 2016",8.3,811,"We witness a few flashbacks from Killua's earlier childhood, mostly between him and Canary. When the flashbacks end, Kikyo, Killua's mother, tells them that Killua cannot see them as he is in solitary confinement. While speaking with the trio, Kikyo suddenly begins screaming to ""Father"" that he not do anything hasty. Killua's grandfather, Zeno, arrives in the dungeon ... Read all",tt2098220,"Gon Freecss aspires to become a Hunter, an exceptional being capable of greatness. With his friends and his potential, he seeks for his father who left him when he was younger."
Hunter x Hunter,1,25,Can't See × If × You're Blind,"Oct 23, 2016",7.8,747,"Kikyo confides in Gotoh, the family butler, how emotionally distraught she is over Killua leaving again. With his father's approval, Killua makes his way to the butler's quarters. He instructs Gotoh to let him know the moment Gon and the other arrive. Gotoh complies, but internal dialogue reveals he has other intentions. Canary guides Gon and his friends to the butler... Read all",tt2098220,"Gon Freecss aspires to become a Hunter, an exceptional being capable of greatness. With his friends and his potential, he seeks for his father who left him when he was younger."
Hunter x Hunter,1,26,Then × and × After,"Nov 6, 2016",4.3,702,A letter from Gon arrives at Whale Island for Aunt Mito. A recap of episodes 14 to 25.,tt2098220,"Gon Freecss aspires to become a Hunter, an exceptional being capable of greatness. With his friends and his potential, he seeks for his father who left him when he was younger."
Hunter x Hunter,1,27,Arrival × at × the Arena,"Nov 13, 2016",8.1,732,"Gon and Killua go to the Heaven's Arena, a place where they can train and earn money by fighting other opponents. Gon and Killua quickly advance to the 150th floor, beating their opponents with a single strike.",tt2098220,"Gon Freecss aspires to become a Hunter, an exceptional being capable of greatness. With his friends and his potential, he seeks for his father who left him when he was younger."
Hunter x Hunter,1,28,Nen × and × Nen,"Nov 20, 2016",8.0,723,"In Wing's room, Gon, Killua and Zushi are being taught by Wing. He explains the 4 main principles: Ten, Ren, Zetsu and Hatsu. He demonstrates how Ren works, by giving Killua the idea of killing him. Because of the strong pressure, Killua was forced to stay back. Wing advised them to train with Zushi and start mastering Ten but Killua suggests that they should leave. K... Read all",tt2098220,"Gon Freecss aspires to become a Hunter, an exceptional being capable of greatness. With his friends and his potential, he seeks for his father who left him when he was younger."
Hunter x Hunter,1,29,Awakening × and × Potential,"Nov 27, 2016",7.9,730,"Gon and Killua's aura nodes finally open thanks to Wing's help. He teaches them how to pass through Hisoka's barrier of Nen. A few hours before midnight, Gon and Killua come back to the hallway that Hisoka is guarding. They successfully pass through and Gon challenges Hisoka to a fight. Hisoka only replies that if Gon manages to win even one match, Hisoka will accept ... Read all",tt2098220,"Gon Freecss aspires to become a Hunter, an exceptional being capable of greatness. With his friends and his potential, he seeks for his father who left him when he was younger."
Hunter x Hunter,1,30,Fierce × and × Ferocious,"Dec 4, 2016",7.9,732,"Gon continues his fight with Gido and begins to understand how the Dancing Tops technique works. After he understands the principle behind the technique he is able to evade the attacks. However, he is not able to go on the offensive because of Gido's Tornado Top defense. Gon continues to fight and manages to release some of his hidden talents but eventually loses the ... Read all",tt2098220,"Gon Freecss aspires to become a Hunter, an exceptional being capable of greatness. With his friends and his potential, he seeks for his father who left him when he was younger."
Hunter x Hunter,1,31,Destiny × and × Tenacity,"Dec 11, 2016",8.3,748,"One month after Gon is seriously injured (and banned to directly practice Nen or be part of any match), the 2-year-lap revenge of the Nen-user Kastro against the magician Hisoka is about to start in the Sky Arena. Castro shows confidence, remembering an old saying, ""not to fight If you do not have a chance of winning"" in this game. Facing to the game, he is also fille... Read all",tt2098220,"Gon Freecss aspires to become a Hunter, an exceptional being capable of greatness. With his friends and his potential, he seeks for his father who left him when he was younger."
Hunter x Hunter,1,32,A × Surprising × Win,"Dec 18, 2016",8.9,936,"Kastro and Hisoka face off in Heaven's Arena. Kastro goes on the offensive and appears to have an advantage. Hisoka is unable to dodge because Kastro creates a Nen double that hides behind Kastro's attacks. Despite losing both arms, Hisoka is confident and performs magic tricks, appearing to reattach one arm. He artfully and secretly uses his Hatsu, ""Bungee Gum"", to k... Read all",tt2098220,"Gon Freecss aspires to become a Hunter, an exceptional being capable of greatness. With his friends and his potential, he seeks for his father who left him when he was younger."
Hunter x Hunter,1,33,An × Empty × Threat,"Jan 8, 2017",8.2,731,"Gon recovered from his injuries and started training Nen along w/ Killua and Zushi from Wing, Sadaso, Riehvelt, Gido kidnap Zushi, Killua agreed to fight Sadaso to leave Zushi alone, Sadaso broke his promise and played dirty tricks Killua threatened him, by the day of their battle came, Sadaso leaves the Arena and lost by default, giving Killua his first win in the ba... Read all",tt2098220,"Gon Freecss aspires to become a Hunter, an exceptional being capable of greatness. With his friends and his potential, he seeks for his father who left him when he was younger."
Hunter x Hunter,1,34,Power × to × Avenge,"Jan 15, 2017",8.5,735,"Gon and Killua both defeated Riehvelt and Gido, Hisoka being impressed with Gon in his matches appeared in Gon's way and invite him to be his next opponent.",tt2098220,"Gon Freecss aspires to become a Hunter, an exceptional being capable of greatness. With his friends and his potential, he seeks for his father who left him when he was younger."
Hunter x Hunter,1,35,The × True × Pass,"Jan 22, 2017",9.3,1200,The fight between Gon and Hisoka begins. At the end Gon successfully punches Hisoka in the face.,tt2098220,"Gon Freecss aspires to become a Hunter, an exceptional being capable of greatness. With his friends and his potential, he seeks for his father who left him when he was younger."
Hunter x Hunter,1,36,A Big Debt × and × a Small Kick,"Jan 29, 2017",9.1,1000,"After punching Hisoka in the face, Gon returns the tag from the Hunter Exam. Hisoka is ecstatic to see Gon's development.",tt2098220,"Gon Freecss aspires to become a Hunter, an exceptional being capable of greatness. With his friends and his potential, he seeks for his father who left him when he was younger."
Hunter x Hunter,1,37,Ging × and × Gon,"Feb 5, 2017",8.0,720,Gon heads home to Whale Island along with Killua. Mito and her grandmother tell Gon about Ging's past. Gon receives a small box from his father. The 2 manages to open the small box and found 3 items and decided to listen to the cassette tape first that contain Ging's voice.,tt2098220,"Gon Freecss aspires to become a Hunter, an exceptional being capable of greatness. With his friends and his potential, he seeks for his father who left him when he was younger."
Hunter x Hunter,1,38,Reply × from × Dad,"Feb 12, 2017",7.6,687,"Gon heard his father's message through the cassette tape. Gon and Killua grab some information about the memory card from the item box. Killua gets a lead from his brother about the game which is going to be presented in the auction, which will be held in Yorkshin City. The two leave Whale island and journey to Yorkshin City.",tt2098220,"Gon Freecss aspires to become a Hunter, an exceptional being capable of greatness. With his friends and his potential, he seeks for his father who left him when he was younger."
Hunter x Hunter,1,39,Wish × and × Promise,"Feb 19, 2017",7.7,679,Kurapika learns about Nen and finds his first job as a hunter.,tt2098220,"Gon Freecss aspires to become a Hunter, an exceptional being capable of greatness. With his friends and his potential, he seeks for his father who left him when he was younger."
Hunter x Hunter,1,40,Nen × Users × Unite?,"Feb 26, 2017",7.8,690,Kurapika and the other job seekers arrive at the home of a human trophy collector and are attacked by an unknown force.,tt2098220,"Gon Freecss aspires to become a Hunter, an exceptional being capable of greatness. With his friends and his potential, he seeks for his father who left him when he was younger."
Hunter x Hunter,1,41,Gathering × of × Heroes,"Mar 5, 2017",7.9,720,Kurapika have to survive a mansion. Gon and Killua travel to the Greed Island.,tt2098220,"Gon Freecss aspires to become a Hunter, an exceptional being capable of greatness. With his friends and his potential, he seeks for his father who left him when he was younger."
Hunter x Hunter,1,42,Defend × and × Attack,"Mar 12, 2017",7.8,707,"The auction is finally about to begin. Gon, Killua and Leorio are working hard to amass enough money to buy Greed Island.",tt2098220,"Gon Freecss aspires to become a Hunter, an exceptional being capable of greatness. With his friends and his potential, he seeks for his father who left him when he was younger."
Hunter x Hunter,1,43,A × Shocking × Tragedy,"Mar 19, 2017",8.7,789,The Phantom Force bursts in the auction.,tt2098220,"Gon Freecss aspires to become a Hunter, an exceptional being capable of greatness. With his friends and his potential, he seeks for his father who left him when he was younger."
Hunter x Hunter,1,44,Buildup × to a × Fierce Battle,"Mar 26, 2017",9.1,992,"The Mafia's secret weapon, the Shadow Beasts, set out to annihilate the Phantom Troupe.",tt2098220,"Gon Freecss aspires to become a Hunter, an exceptional being capable of greatness. With his friends and his potential, he seeks for his father who left him when he was younger."
Hunter x Hunter,1,45,Restraint × and × Vow,"Apr 2, 2017",8.7,752,Kurapika has captured a member of the Phantom Troupe.,tt2098220,"Gon Freecss aspires to become a Hunter, an exceptional being capable of greatness. With his friends and his potential, he seeks for his father who left him when he was younger."
Hunter x Hunter,1,46,Chasing × and × Waiting,"Apr 9, 2017",8.2,687,"Kurapika sends the Boss away to safety, and then waits to confront the Phantom Troupe alone.",tt2098220,"Gon Freecss aspires to become a Hunter, an exceptional being capable of greatness. With his friends and his potential, he seeks for his father who left him when he was younger."
Hunter x Hunter,1,47,Condition × and × Condition,"Apr 16, 2017",9.6,1800,Kurapika finds himself face to face with Uvogin.,tt2098220,"Gon Freecss aspires to become a Hunter, an exceptional being capable of greatness. With his friends and his potential, he seeks for his father who left him when he was younger."
Hunter x Hunter,1,48,Very × Sharp × Eye,"Apr 23, 2017",7.3,698,"At the antiques market, Gon discovers a foolproof way to appraise valuable items",tt2098220,"Gon Freecss aspires to become a Hunter, an exceptional being capable of greatness. With his friends and his potential, he seeks for his father who left him when he was younger."
Hunter x Hunter,1,49,Pursuit × and × Analysis,"Apr 30, 2017",8.6,784,Gon and the others plan to raise the money they need by collecting the bounties placed on the Troupe.,tt2098220,"Gon Freecss aspires to become a Hunter, an exceptional being capable of greatness. With his friends and his potential, he seeks for his father who left him when he was younger."
Hunter x Hunter,1,50,Ally × and × Sword,"May 7, 2017",8.6,724,The Phantom Troupe captures Gon and Killua.,tt2098220,"Gon Freecss aspires to become a Hunter, an exceptional being capable of greatness. With his friends and his potential, he seeks for his father who left him when he was younger."
Hunter x Hunter,1,51,A × Brutal × Battlefield,"May 14, 2017",9.4,1400,"Kurapika's desire to destroy the Phantom Troupe gets him recruited into a newly formed team of assassins. Neon manages to slip away during an unguarded moment to attend the auction. As she is trying to enter the auction site, Chrollo, the leader of the Phantom Troupe, approaches her.",tt2098220,"Gon Freecss aspires to become a Hunter, an exceptional being capable of greatness. With his friends and his potential, he seeks for his father who left him when he was younger."
Hunter x Hunter,1,52,Assault × and × Impact,"May 21, 2017",9.4,1300,"To avenge Uvogin, the Phantom Troupe infiltrates the auction to wreak havoc in his honor. Chrollo kills off the Ten Don's assassins one by one. As the fighting continues, Zeno and Silva of the legendary Zoldyck family of assassins arrive to eliminate the Phantom Troupe.",tt2098220,"Gon Freecss aspires to become a Hunter, an exceptional being capable of greatness. With his friends and his potential, he seeks for his father who left him when he was younger."
Hunter x Hunter,1,53,Fake × and × Psyche,"Jun 4, 2017",8.5,726,"The leader of the Phantom Troupe is dead. The sudden news shocks Kurapika, who heads to the auction site in disbelief, determined to confirm it for himself.",tt2098220,"Gon Freecss aspires to become a Hunter, an exceptional being capable of greatness. With his friends and his potential, he seeks for his father who left him when he was younger."
Hunter x Hunter,1,54,Fortunes × Aren't × Right?,"Jun 11, 2017",8.2,673,"Gon, Killua, Kurapika and Leorio finally reunite. Kurapika recounts the events that have occurred and reveals his new Nen ability. Killua fears for Kurapika's safety after he remembers someone in the Phantom Troupe can read memories. Chrollo uses Neon's Nen power to predict the future of each member of the Phantom Troupe.",tt2098220,"Gon Freecss aspires to become a Hunter, an exceptional being capable of greatness. With his friends and his potential, he seeks for his father who left him when he was younger."
Hunter x Hunter,1,55,Alies × and × Lies,"Jun 18, 2017",8.1,687,"Just as Chrollo's fortune predicted, Hisoka is suspected of betraying the troupe. Meanwhile, Kurapika learns that the Phantom Troupe is still alive. He teams up with his friends to capture Pakunoda.",tt2098220,"Gon Freecss aspires to become a Hunter, an exceptional being capable of greatness. With his friends and his potential, he seeks for his father who left him when he was younger."
Hunter x Hunter,1,56,Beloved × and × Beleaguered,"Jun 25, 2017",8.5,694,"Chrollo uses the information he has on Neon to identify the location of the chain user, Kurapika. Meanwhile, Killua is keeping an eye on the Phantom Troupe base when he is joined by Melody, who helps determine that the Troupe is headed towards Kurapika's hotel. The Troupe is finally closing in on Kurapika.",tt2098220,"Gon Freecss aspires to become a Hunter, an exceptional being capable of greatness. With his friends and his potential, he seeks for his father who left him when he was younger."
