tv,season,episode_number,title,airdate,rating,total_votes,episode_desc,encoded_title,show_desc
Attack on Titan,3,20,That Day,"Jun 17, 2019",9.9,33991,"A look into Grisha's memories shows Eren the many secrets his father was hiding, including one which led to his mother's demise.",tt2560140,"After his hometown is destroyed and his mother is killed, young Eren Jaeger vows to cleanse the earth of the giant humanoid Titans that have brought humanity to the brink of extinction."
Attack on Titan,3,21,Attack Titan,"Jun 24, 2019",9.8,19751,"Eren learns how all paths connect in the story that his father began. If Grisha is to pay for his sins, he must fight for freedom and take a stand.",tt2560140,"After his hometown is destroyed and his mother is killed, young Eren Jaeger vows to cleanse the earth of the giant humanoid Titans that have brought humanity to the brink of extinction."
Attack on Titan,3,22,The Other Side of the Wall,"Jul 1, 2019",9.7,16810,"Though it's met with hope and despair, the truth is made public. The Scouts then venture beyond the walls to see if it's everything they dreamed of.",tt2560140,"After his hometown is destroyed and his mother is killed, young Eren Jaeger vows to cleanse the earth of the giant humanoid Titans that have brought humanity to the brink of extinction."
Attack on Titan,4,1,The Other Side of the Sea,"Dec 6, 2020",9.5,30018,"As Marley battles the Mid-East Alliance to end a four-year war, a group of Warrior candidates on the front lines compete to be the successor of the Armored Titan.",tt2560140,"After his hometown is destroyed and his mother is killed, young Eren Jaeger vows to cleanse the earth of the giant humanoid Titans that have brought humanity to the brink of extinction."
Attack on Titan,4,2,Midnight Train,"Dec 13, 2020",9.0,26646,"Though glad the war is over, Both the Eldian Warriors and Marley brass realize that neither have a future unless they finish the job of retaking the Founding Titan.",tt2560140,"After his hometown is destroyed and his mother is killed, young Eren Jaeger vows to cleanse the earth of the giant humanoid Titans that have brought humanity to the brink of extinction."
Attack on Titan,4,3,The Door of Hope,"Dec 20, 2020",9.5,26611,"A flashback into Reiner's harsh and difficult life, and his own personal wish to become a Marleyan Warrior for his family honor.",tt2560140,"After his hometown is destroyed and his mother is killed, young Eren Jaeger vows to cleanse the earth of the giant humanoid Titans that have brought humanity to the brink of extinction."
Attack on Titan,4,4,From One Hand to Another,"Dec 27, 2020",9.2,25512,Magath joins hands with the Tyburs and makes preparations for the upcoming festival in Liberio.,tt2560140,"After his hometown is destroyed and his mother is killed, young Eren Jaeger vows to cleanse the earth of the giant humanoid Titans that have brought humanity to the brink of extinction."
Attack on Titan,4,5,Declaration of War,"Jan 10, 2021",9.9,54471,"Eren confronts Reiner, while Willy Tybur gives a speech to the entire world in which he aims to solve the endless cycle of hate directed towards Eldians.",tt2560140,"After his hometown is destroyed and his mother is killed, young Eren Jaeger vows to cleanse the earth of the giant humanoid Titans that have brought humanity to the brink of extinction."
Attack on Titan,4,6,The War Hammer Titan,"Jan 17, 2021",9.9,53231,"As the Attack Titan rampages, several people are crushed to death. While all of this is going on, the War Hammer Titan appears to confront Eren.",tt2560140,"After his hometown is destroyed and his mother is killed, young Eren Jaeger vows to cleanse the earth of the giant humanoid Titans that have brought humanity to the brink of extinction."
Attack on Titan,4,7,Assault,"Jan 24, 2021",9.9,70373,"As the battle between Eren and the warriors rages on, another party makes their move on Marley's Forces that pushes the tide of the battle into a more devastating climax.",tt2560140,"After his hometown is destroyed and his mother is killed, young Eren Jaeger vows to cleanse the earth of the giant humanoid Titans that have brought humanity to the brink of extinction."
Attack on Titan,4,8,Assassin's Bullet,"Jan 31, 2021",9.6,31238,"Out of strength, the Armored Titan falls. Furious to have her hometown trampled, Gabi picks up a gun and takes off.",tt2560140,"After his hometown is destroyed and his mother is killed, young Eren Jaeger vows to cleanse the earth of the giant humanoid Titans that have brought humanity to the brink of extinction."
Attack on Titan,4,9,Brave Volunteers,"Feb 7, 2021",9.2,23192,"As Paradis deals with the aftermath of the raid on Liberio, Armin looks back in the past to meeting the volunteer soldiers who reshaped their world.",tt2560140,"After his hometown is destroyed and his mother is killed, young Eren Jaeger vows to cleanse the earth of the giant humanoid Titans that have brought humanity to the brink of extinction."
Attack on Titan,4,10,A Sound Argument,"Feb 14, 2021",8.9,20293,"Two years ago, Paradis welcomed their first visitor who was surprised to see one of their own. Obtaining their help will be critical in a three-part plan to protect Paradis.",tt2560140,"After his hometown is destroyed and his mother is killed, young Eren Jaeger vows to cleanse the earth of the giant humanoid Titans that have brought humanity to the brink of extinction."
Attack on Titan,4,11,Deceiver,"Feb 21, 2021",9.1,18561,"Gabi and Falco escape from prison. Without a clue where they should go, they receive help from none other than the devils they despise. Meanwhile, Floch's mind is shifting gears.",tt2560140,"After his hometown is destroyed and his mother is killed, young Eren Jaeger vows to cleanse the earth of the giant humanoid Titans that have brought humanity to the brink of extinction."
Attack on Titan,4,12,Guides,"Feb 28, 2021",9.2,18353,"A new turn of events rocks the Military Corps. In the midst of confusion, Eren begins enacting his plans for Paradis.",tt2560140,"After his hometown is destroyed and his mother is killed, young Eren Jaeger vows to cleanse the earth of the giant humanoid Titans that have brought humanity to the brink of extinction."
Attack on Titan,4,13,Children of the Forest,"Mar 7, 2021",9.7,22645,Gabi and Falco seek assistance from the captured Marleyan soldiers. Will their faith in their countrymen be rewarded or betrayed?,tt2560140,"After his hometown is destroyed and his mother is killed, young Eren Jaeger vows to cleanse the earth of the giant humanoid Titans that have brought humanity to the brink of extinction."
Attack on Titan,4,14,Savagery,"Mar 21, 2021",9.8,23865,"The Jaegerists capture Hange and the others. Staring intensely at Armin and Mikasa, Eren says that he wants to talk. Levi confronts Zeke.",tt2560140,"After his hometown is destroyed and his mother is killed, young Eren Jaeger vows to cleanse the earth of the giant humanoid Titans that have brought humanity to the brink of extinction."
Attack on Titan,4,15,Sole Salvation,"Mar 21, 2021",9.7,21502,Zeke recalls his childhood and how he was forced to become part of his parents' plan to free Eldia from Marley.,tt2560140,"After his hometown is destroyed and his mother is killed, young Eren Jaeger vows to cleanse the earth of the giant humanoid Titans that have brought humanity to the brink of extinction."
Attack on Titan,4,16,Above and Below,"Mar 28, 2021",9.6,21720,"With the Jaegerists now in charge, Zeke's master plan is revealed. But before it is put in motion, Eren recruits help to flush out any invaders in their midst.",tt2560140,"After his hometown is destroyed and his mother is killed, young Eren Jaeger vows to cleanse the earth of the giant humanoid Titans that have brought humanity to the brink of extinction."
Attack on Titan,4,17,Judgment,"Jan 9, 2022",9.1,32110,"The Marleyan military's air force invades Paradis, while Eren Yeager continues battling Porco Galliard, who is soon joined by Reiner Braun in his Armored Titan form.",tt2560140,"After his hometown is destroyed and his mother is killed, young Eren Jaeger vows to cleanse the earth of the giant humanoid Titans that have brought humanity to the brink of extinction."
Attack on Titan,4,18,Sneak Attack,"Jan 16, 2022",9.4,26508,"The Beast Titan joins the fray, but General Magath is determined to take him down. Meanwhile, with the city in flames, Colt and Gabi rush to rescue Falco who's held captive by the Jaegerists.",tt2560140,"After his hometown is destroyed and his mother is killed, young Eren Jaeger vows to cleanse the earth of the giant humanoid Titans that have brought humanity to the brink of extinction."
Attack on Titan,4,19,Two Brothers,"Jan 23, 2022",9.7,53464,"Colt pleads with Zeke to not use his scream and turn Falco into a Titan. All the while, soldiers and Titans clash in battle as Eren struggles to make contact with his brother.",tt2560140,"After his hometown is destroyed and his mother is killed, young Eren Jaeger vows to cleanse the earth of the giant humanoid Titans that have brought humanity to the brink of extinction."
Attack on Titan,4,20,Memories of the Future,"Jan 30, 2022",9.9,43099,"Zeke takes Eren through Grisha's memories to show him how he's been brainwashed. But in doing so, Zeke discovers something about Eren that he never knew.",tt2560140,"After his hometown is destroyed and his mother is killed, young Eren Jaeger vows to cleanse the earth of the giant humanoid Titans that have brought humanity to the brink of extinction."
Attack on Titan,4,21,"From You, 2000 Years Ago","Feb 6, 2022",9.9,40668,"Eren and Zeke with their contradicted ethics and shattered emotions, clash on the credibility of their ideals while Ymir, the founder, discloses her tragic past and deepest secrets within the walls.",tt2560140,"After his hometown is destroyed and his mother is killed, young Eren Jaeger vows to cleanse the earth of the giant humanoid Titans that have brought humanity to the brink of extinction."
Attack on Titan,4,22,Episode #4.22,"Feb 13, 2022",9.4,179,"Know what this is about?
 Be the first one to add a plot.",tt2560140,"After his hometown is destroyed and his mother is killed, young Eren Jaeger vows to cleanse the earth of the giant humanoid Titans that have brought humanity to the brink of extinction."
