tv,season,episode_number,title,airdate,rating,total_votes,episode_desc,episode_url,encoded_title,show_desc
Dopesick,1,1,First Bottle,"Oct 13, 2021",8.1,1200,"Richard Sackler begins to launch a powerful new painkiller, a rural doctor is introduced to the drug, a coal miner plans her future, a DEA agent learns of black market pills and federal prosecutors decide to open a case into OxyContin.",https://www.imdb.com/title/tt12536068/,tt9174558,"The series takes viewers to the epicenter of America's struggle with opioid addiction, from the boardrooms of Purdue Pharma, to a distressed Virginia mining community, to the hallways of the DEA."
Dopesick,1,2,Breakthrough Pain,"Oct 13, 2021",8.3,1100,"OxyContin is on the market but faces a potential threat, Purdue's vast influence reaches the town of Finch Creek, Bridget steps outside her DEA authority and the criminal investigation of OxyContin begins.",https://www.imdb.com/title/tt12536074/,tt9174558,"The series takes viewers to the epicenter of America's struggle with opioid addiction, from the boardrooms of Purdue Pharma, to a distressed Virginia mining community, to the hallways of the DEA."
Dopesick,1,3,The 5th Vital Sign,"Oct 13, 2021",8.5,1000,"Doctor Finnix begins to take Betsy off OxyContin, Bridget sees the toll the it's taking on communities, Rick and Randy investigate the world of ""pain societies"" and, with sales climbing, Richard Sackler makes bigger plans for his new drug.",https://www.imdb.com/title/tt12536076/,tt9174558,"The series takes viewers to the epicenter of America's struggle with opioid addiction, from the boardrooms of Purdue Pharma, to a distressed Virginia mining community, to the hallways of the DEA."
Dopesick,1,4,Pseudo-Addiction,"Oct 20, 2021",8.6,1000,"Sky-high OxyContin sales are threatened by reports of abuse, prosecutors investigate a claim central to OxyContin marketing, and Finnix begins to question the safety of the drug.",https://www.imdb.com/title/tt12536086/,tt9174558,"The series takes viewers to the epicenter of America's struggle with opioid addiction, from the boardrooms of Purdue Pharma, to a distressed Virginia mining community, to the hallways of the DEA."
Dopesick,1,5,The Whistleblower,"Oct 27, 2021",8.7,955,"With OxyContin abuse spreading across the country, Bridget brings the fight to Purdue while Rick and Randy seek to find a whistleblower within Purdue to tie their case together.",https://www.imdb.com/title/tt12536088/,tt9174558,"The series takes viewers to the epicenter of America's struggle with opioid addiction, from the boardrooms of Purdue Pharma, to a distressed Virginia mining community, to the hallways of the DEA."
Dopesick,1,6,Hammer the Abusers,"Nov 3, 2021",8.6,912,"Richard Sackler faces a catastrophic challenge to Purdue's bottom line, Bridget takes her fight to the FDA, Finnix reassesses his life as Betsy struggles to kick her addiction, and Rick and Randy find a bombshell piece of evidence.",https://www.imdb.com/title/tt12536090/,tt9174558,"The series takes viewers to the epicenter of America's struggle with opioid addiction, from the boardrooms of Purdue Pharma, to a distressed Virginia mining community, to the hallways of the DEA."
Dopesick,1,7,Black Box Warning,"Nov 10, 2021",9.0,975,"Richard Sackler and Purdue work the system to prevent their drug from being reined in, Bridget has a breakthrough in her mission, Betsy has hit rock-bottom while Finnix explores new avenues, and Rick and Randy ready their criminal case.",https://www.imdb.com/title/tt12536092/,tt9174558,"The series takes viewers to the epicenter of America's struggle with opioid addiction, from the boardrooms of Purdue Pharma, to a distressed Virginia mining community, to the hallways of the DEA."
Dopesick,1,8,The People vs. Purdue Pharma,"Nov 17, 2021",8.8,888,"Rick and Randy's criminal investigation now threatens Richard Sackler's empire, activists take action against Purdue, and Finnix tries to heal his beloved community that's been ravaged by addiction.",https://www.imdb.com/title/tt12536094/,tt9174558,"The series takes viewers to the epicenter of America's struggle with opioid addiction, from the boardrooms of Purdue Pharma, to a distressed Virginia mining community, to the hallways of the DEA."
